"8gram","Frequency","Total Tweets"
"滥用出口管制措施","3","3"
"动汽车制造商正在","3","3"
"中国国家气候中心","3","3"
"的国际癌症研究机","3","3"
"国际癌症研究机构","3","3"
"日本大企业夏季奖","3","3"
"本大企业夏季奖金","3","3"
"日本原子能规制委","3","3"
"本原子能规制委员","3","3"
"月航空货物出口量","3","3"
"航空货物出口量同","3","3"
"空货物出口量同比","3","3"
"在岸人民币兑美元","3","3"
"的福岛第一核电站","3","3"
"国际合作高峰论坛","3","3"
"中不可或缺的一部","3","3"
"务危机的中国恒大","3","3"
"国民党副主席夏立","3","3"
"民党副主席夏立言","3","3"
"中国阿里巴巴集团","3","3"
"阿里巴巴集团创始","3","3"
"里巴巴集团创始人","3","3"
"巴巴集团创始人马","3","3"
"巴集团创始人马云","3","3"
"俄罗斯天然气的依","3","3"
"罗斯天然气的依赖","3","3"
"中国驻韩国大使邢","3","3"
"国驻韩国大使邢海","3","3"
"驻韩国大使邢海明","3","3"
"共总书记习近平星","3","3"
"总书记习近平星期","3","3"
"日本央行决定维持","3","3"
"联邦贸易委员会周","3","3"
"岛第一核电站的核","3","3"
"团创办人郭台铭星","3","3"
"世界气象组织警告","3","3"
"将暂停在俄罗斯的","3","3"
"暂停在俄罗斯的业","3","3"
"停在俄罗斯的业务","3","3"
"乘用车销量同比增","3","3"
"用车销量同比增长","3","3"
"世界半导体贸易统","3","3"
"界半导体贸易统计","3","3"
"半导体贸易统计组","3","3"
"导体贸易统计组织","3","3"
"苹果公司新发布的","3","3"
"关系日益紧张之际","3","3"
"交易委员会周一起","3","3"
"易委员会周一起诉","3","3"
"公司字节跳动的一","3","3"
"世界第一人口大国","3","3"
"美国股市主要股指","3","3"
"在众议院获得通过","3","3"
"全球前两大经济体","3","3"
"月份官方制造业采","3","3"
"份官方制造业采购","3","3"
"官方制造业采购经","3","3"
"方制造业采购经理","3","3"
"开发出不使用稀有","3","3"
"发出不使用稀有金","3","3"
"出不使用稀有金属","3","3"
"部长里亚布科夫说","3","3"
"方国家向乌克兰提","3","3"
"国家向乌克兰提供","3","3"
"总统选举第二轮投","3","3"
"统选举第二轮投票","3","3"
"美国一项研究发现","3","3"
"被中国消费者抵制","3","3"
"日产开发出可紧急","3","3"
"产开发出可紧急避","3","3"
"开发出可紧急避让","3","3"
"发出可紧急避让连","3","3"
"出可紧急避让连环","3","3"
"可紧急避让连环事","3","3"
"紧急避让连环事故","3","3"
"急避让连环事故的","3","3"
"避让连环事故的自","3","3"
"让连环事故的自动","3","3"
"连环事故的自动驾","3","3"
"环事故的自动驾驶","3","3"
"事故的自动驾驶技","3","3"
"故的自动驾驶技术","3","3"
"日产试制车配备了","3","3"
"结合三种设备的功","3","3"
"合三种设备的功能","3","3"
"而且无需导航也能","3","3"
"且无需导航也能准","3","3"
"无需导航也能准确","3","3"
"需导航也能准确掌","3","3"
"导航也能准确掌握","3","3"
"航也能准确掌握位","3","3"
"也能准确掌握位置","3","3"
"日产还开发了关于","3","3"
"产还开发了关于车","3","3"
"还开发了关于车辆","3","3"
"开发了关于车辆控","3","3"
"发了关于车辆控制","3","3"
"了关于车辆控制的","3","3"
"关于车辆控制的算","3","3"
"于车辆控制的算法","3","3"
"暂未出现人员伤亡","3","3"
"开始统计以来的最","3","3"
"始统计以来的最高","3","3"
"欧盟隐私监管机构","3","3"
"经济学家在一份报","3","3"
"济学家在一份报告","3","3"
"学家在一份报告中","3","3"
"新兴和发展中国家","3","3"
"众党主席柯文哲星","3","3"
"党主席柯文哲星期","3","3"
"短视频社交媒体平","3","3"
"视频社交媒体平台","3","3"
"争取国民党提名参","3","3"
"取国民党提名参选","3","3"
"联合国人权理事会","3","3"
"集團有限公司獲悉","3","3"
"美国一项研究显示","3","3"
"社会融资规模增量","3","3"
"华特迪士尼公司公","3","3"
"特迪士尼公司公布","3","3"
"第一财季净利润为","3","3"
"有史以来最畅销的","3","3"
"美国职业棒球大联","3","3"
"国职业棒球大联盟","3","3"
"新一代电池的开发","3","3"
"的二氧化碳排放量","3","3"
"家主席習近平和夫","3","3"
"主席習近平和夫人","3","3"
"席習近平和夫人彭","3","3"
"習近平和夫人彭麗","3","3"
"近平和夫人彭麗媛","3","3"
"中国今年的经济增","3","3"
"国今年的经济增长","3","3"
"执掌的伯克希尔哈","3","3"
"掌的伯克希尔哈撒","3","3"
"苹果公司总执行长","3","3"
"果公司总执行长库","3","3"
"公司总执行长库克","3","3"
"美国硅谷银行倒闭","3","3"
"日本经济从新冠疫","3","3"
"本经济从新冠疫情","3","3"
"个百分点的可能性","3","3"
"美国众议院议长麦","3","3"
"国众议院议长麦卡","3","3"
"商富士康科技集团","3","3"
"的新北市长侯友宜","3","3"
"证券交易委员会提","3","3"
"台积电在美国亚利","3","3"
"积电在美国亚利桑","3","3"
"电在美国亚利桑那","3","3"
"新一轮房地产降温","3","3"
"一轮房地产降温措","3","3"
"轮房地产降温措施","3","3"
"中国放宽防疫措施","3","3"
"国放宽防疫措施后","3","3"
"年来首次出现同比","3","3"
"纯电动汽车的电池","3","3"
"车和插电式混动车","3","3"
"无人员伤亡和财产","3","3"
"人员伤亡和财产损","3","3"
"员伤亡和财产损失","3","3"
"伤亡和财产损失报","3","3"
"亡和财产损失报告","3","3"
"总统小马可斯将在","3","3"
"月来自中国的订单","3","3"
"推出新款纯电动汽","3","3"
"出新款纯电动汽车","3","3"
"吸引了众多游客前","3","3"
"受日本经济新闻采","3","3"
"日本经济新闻采访","3","3"
"委员兼国防部长李","3","3"
"员兼国防部长李尚","3","3"
"兼国防部长李尚福","3","3"
"进一步投资日本股","3","3"
"比特币和加密货币","3","3"
"以来最严重的禽流","3","3"
"来最严重的禽流感","3","3"
"美国商品期货交易","3","3"
"国商品期货交易委","3","3"
"商品期货交易委员","3","3"
"品期货交易委员会","3","3"
"疫情和乌克兰战争","3","3"
"美国硅谷银行破产","3","3"
"为美国联邦储备局","3","3"
"小贩中心和咖啡店","3","3"
"著名旅游景点清迈","3","3"
"其旗舰搜索引擎中","3","3"
"日益增长的影响力","3","3"
"因俄罗斯入侵乌克","3","3"
"罗斯入侵乌克兰而","3","3"
"會長兼社長孫正義","3","3"
"蘋果仍難以擺脫依","3","3"
"果仍難以擺脫依賴","3","3"
"仍難以擺脫依賴中","3","3"
"難以擺脫依賴中國","3","3"
"以擺脫依賴中國的","3","3"
"擺脫依賴中國的窘","3","3"
"脫依賴中國的窘境","3","3"
"原因是華為和小米","3","3"
"因是華為和小米等","3","3"
"是華為和小米等企","3","3"
"華為和小米等企業","3","3"
"為和小米等企業崛","3","3"
"和小米等企業崛起","3","3"
"中國已成為全球智","3","3"
"手機技術的發源地","3","3"
"货币市场基金资产","3","3"
"西亚著名旅游胜地","3","3"
"对中国经济前景的","3","3"
"耶稣受难日长周末","3","3"
"在俄乌战争爆发后","3","3"
"于半导体制造设备","3","3"
"将全力争取国民党","3","3"
"电视用大尺寸液晶","3","3"
"视用大尺寸液晶面","3","3"
"用大尺寸液晶面板","3","3"
"前往新加坡工作的","3","3"
"美国亚利桑那州一","3","3"
"沙特王储穆罕默德","3","3"
"摩根大通公司首席","3","3"
"根大通公司首席执","3","3"
"大通公司首席执行","3","3"
"通公司首席执行官","3","3"
"通讯及多媒体委员","3","3"
"讯及多媒体委员会","3","3"
"财长和央行行长会","3","3"
"长和央行行长会议","3","3"
"在印度尼西亚峇厘","3","3"
"全面与进步跨太平","3","3"
"面与进步跨太平洋","3","3"
"与进步跨太平洋伙","3","3"
"进步跨太平洋伙伴","3","3"
"步跨太平洋伙伴关","3","3"
"跨太平洋伙伴关系","3","3"
"太平洋伙伴关系协","3","3"
"平洋伙伴关系协定","3","3"
"美国大型科技企业","3","3"
"金融危机以来最大","3","3"
"产业技术综合开发","3","3"
"业技术综合开发机","3","3"
"技术综合开发机构","3","3"
"在乌克兰的军事行","3","3"
"乌克兰的军事行动","3","3"
"密货币交易平台币","3","3"
"货币交易平台币安","3","3"
"国国务委员兼外长","3","3"
"斯总统普京星期六","3","3"
"的中国发展高层论","3","3"
"美中贸易全国委员","3","3"
"中贸易全国委员会","3","3"
"这款热门短视频应","3","3"
"款热门短视频应用","3","3"
"驻韩国大使馆星期","3","3"
"在乌克兰问题上的","3","3"
"在很大程度上是因","3","3"
"将取代锂离子电池","3","3"
"对中国大陆和香港","3","3"
"美国司法部正在调","3","3"
"国司法部正在调查","3","3"
"日本经济新闻分析","3","3"
"电创办人张忠谋说","3","3"
"富士康科技集团表","3","3"
"士康科技集团表示","3","3"
"乘搭公共交通工具","3","3"
"和美国国债收益率","3","3"
"日元兑美元一度升","3","3"
"媒体引述知情人士","3","3"
"中国科学院深海科","3","3"
"国科学院深海科学","3","3"
"科学院深海科学与","3","3"
"学院深海科学与工","3","3"
"院深海科学与工程","3","3"
"深海科学与工程研","3","3"
"海科学与工程研究","3","3"
"科学与工程研究所","3","3"
"美国佛罗里达州发","3","3"
"国佛罗里达州发射","3","3"
"澳大利亚昆士兰州","3","3"
"陷入困境的开发商","3","3"
"中国今明两年经济","3","3"
"今明两年经济增长","3","3"
"在伦敦证券交易所","3","3"
"伦敦证券交易所上","3","3"
"敦证券交易所上市","3","3"
"香港特区行政长官","3","3"
"与中国企业的竞争","3","3"
"中国严格的防疫措","3","3"
"国严格的防疫措施","3","3"
"将不得不进一步加","3","3"
"建纯电动汽车工厂","3","3"
"对欧洲天然气供应","3","3"
"国驻新加坡大使馆","3","3"
"美国亿万富翁马斯","3","3"
"国亿万富翁马斯克","3","3"
"贬值和资源价格走","3","3"
"值和资源价格走高","3","3"
"半导体制造设备销","3","3"
"导体制造设备销售","3","3"
"体制造设备销售额","3","3"
"中共中央外事办公","3","3"
"共中央外事办公室","3","3"
"中央外事办公室主","3","3"
"央外事办公室主任","3","3"
"软收购动视暴雪的","3","3"
"每名女性一生中生","3","3"
"名女性一生中生育","3","3"
"女性一生中生育孩","3","3"
"性一生中生育孩子","3","3"
"接受日经采访时表","3","3"
"受日经采访时表示","3","3"
"今年以来累计上涨","3","3"
"美国芯片设计公司","3","3"
"首都布宜诺斯艾利","3","3"
"都布宜诺斯艾利斯","3","3"
"律宾在南中国海的","3","3"
"中华人民共和国反","3","3"
"航天员乘组状态良","3","3"
"天员乘组状态良好","3","3"
"空间站组合体运行","3","3"
"间站组合体运行稳","3","3"
"站组合体运行稳定","3","3"
"美国股市周三下跌","3","3"
"在一定程度上抵消","3","3"
"一定程度上抵消了","3","3"
"由于全球通货膨胀","3","3"
"与美国国务卿布林","3","3"
"次世界大战以来最","3","3"
"公司股价在盘后交","3","3"
"司股价在盘后交易","3","3"
"在吉隆坡国际机场","3","3"
"新马第二通道关卡","3","3"
"官房长官松野博一","3","3"
"据美国国家航空航","3","3"
"全球通货膨胀压力","3","3"
"芯片和智能手机业","3","3"
"片和智能手机业务","3","3"
"扎波罗热核电站周","3","3"
"波罗热核电站周围","3","3"
"西兰最大城市奥克","3","3"
"兰最大城市奥克兰","3","3"
"造成至少四人死亡","3","3"
"国疾病预防控制中","3","3"
"国前总统特朗普星","3","3"
"东京圈新建住宅均","3","3"
"京圈新建住宅均价","3","3"
"奥地利首都维也纳","3","3"
"食品药品监督管理","3","3"
"品药品监督管理局","3","3"
"美国劳动力市场依","3","3"
"国劳动力市场依然","3","3"
"暂无人员伤亡报告","3","3"
"入比上年同期增长","3","3"
"全球最大的两个经","3","3"
"球最大的两个经济","3","3"
"美国对中国半导体","3","3"
"两位知情人士透露","3","3"
"马来西亚吉隆坡国","3","3"
"来西亚吉隆坡国际","3","3"
"研究中心的一项新","3","3"
"在答記者問時表示","3","3"
"美国人工智能巨头","3","3"
"国人工智能巨头英","3","3"
"人工智能巨头英伟","3","3"
"工智能巨头英伟达","3","3"
"中国进口商品加征","3","3"
"位于加利福尼亚州","3","3"
"硅谷的数百个工作","3","3"
"谷的数百个工作岗","3","3"
"的数百个工作岗位","3","3"
"接受媒体访问时说","3","3"
"加密货币贷款机构","3","3"
"金融巨头房地美周","3","3"
"融巨头房地美周四","3","3"
"彭博社引述知情人","3","3"
"博社引述知情人士","3","3"
"冠病疫情防控措施","3","3"
"元的人民币计价债","3","3"
"一度冲上微博热搜","3","3"
"美国消费者金融保","3","3"
"国消费者金融保护","3","3"
"援引知情人士报道","3","3"
"的动态清零防疫政","3","3"
"在尖端半导体领域","3","3"
"城市新建商品住宅","3","3"
"新建商品住宅销售","3","3"
"建商品住宅销售价","3","3"
"宇航员前往国际空","3","3"
"航员前往国际空间","3","3"
"员前往国际空间站","3","3"
"美國總統特朗普在","3","3"
"瑞典和芬兰加入北","3","3"
"典和芬兰加入北约","3","3"
"湾疫情指挥中心发","3","3"
"疫情指挥中心发言","3","3"
"情指挥中心发言人","3","3"
"指挥中心发言人庄","3","3"
"挥中心发言人庄人","3","3"
"中心发言人庄人祥","3","3"
"背后的原因是什么","3","3"
"月消费者物价指数","3","3"
"巴西前总统博索纳","3","3"
"西前总统博索纳罗","3","3"
"济从疫情中复苏的","3","3"
"时间才能完全恢复","3","3"
"上海浦东国际机场","3","3"
"这家金融科技巨头","3","3"
"欧洲疾病预防控制","3","3"
"变异毒株快速传播","3","3"
"中国金融监管部门","3","3"
"联合国世界粮食计","3","3"
"合国世界粮食计划","3","3"
"国世界粮食计划署","3","3"
"美国股市周三上涨","3","3"
"私募股权投资基金","3","3"
"卫生健康委员会官","3","3"
"生健康委员会官员","3","3"
"据彭博亿万富翁指","3","3"
"对来自中国的旅客","3","3"
"禁止公务机关使用","3","3"
"乌克兰的特别军事","3","3"
"克兰的特别军事行","3","3"
"兰的特别军事行动","3","3"
"中国放宽疫情管控","3","3"
"国外交部发言人华","3","3"
"外交部发言人华春","3","3"
"交部发言人华春莹","3","3"
"投资者乐观地认为","3","3"
"中国这个全球第二","3","3"
"国这个全球第二大","3","3"
"美股收盘涨跌互现","3","3"
"采取刑事强制措施","3","3"
"冠病变种病毒奥密","3","3"
"病变种病毒奥密克","3","3"
"自第二次世界大战","3","3"
"俄罗斯石油设定价","3","3"
"罗斯石油设定价格","3","3"
"斯石油设定价格上","3","3"
"石油设定价格上限","3","3"
"要求香港产品贴上","3","3"
"美国参议院通过了","3","3"
"违反了国际贸易规","3","3"
"发展本土芯片产业","3","3"
"与该加密货币交易","3","3"
"新竹市长当选人高","3","3"
"竹市长当选人高虹","3","3"
"市长当选人高虹安","3","3"
"移民与关卡局提醒","3","3"
"总统特朗普威胁要","3","3"
"调查中国人工智能","3","3"
"遺成功後的首個春","3","3"
"成功後的首個春節","3","3"
"原则上接受东帝汶","3","3"
"俄罗斯外交部副部","3","3"
"罗斯外交部副部长","3","3"
"的中国母公司字节","3","3"
"在柬埔寨首都金边","3","3"
"晶片制造商长江存","3","3"
"制造商长江存储科","3","3"
"造商长江存储科技","3","3"
"人工智能芯片制造","3","3"
"工智能芯片制造商","3","3"
"连续第二个月下滑","3","3"
"美国联合大陆表示","3","3"
"和呼吸道合胞病毒","3","3"
"新加坡国立大学的","3","3"
"在美国上市的中概","3","3"
"罗斯总统普京通电","3","3"
"斯总统普京通电话","3","3"
"世界自然保护联盟","3","3"
"特斯拉上海工厂的","3","3"
"退出动态清零政策","3","3"
"在中国国家主席习","3","3"
"国电动汽车巨头比","3","3"
"电动汽车巨头比亚","3","3"
"动汽车巨头比亚迪","3","3"
"印度尼西亚西爪哇","3","3"
"度尼西亚西爪哇省","3","3"
"台积电亚利桑那州","3","3"
"赛正如火如荼展开","3","3"
"电在亚利桑那州的","3","3"
"美国宾夕法尼亚州","3","3"
"新创公司深度求索","3","3"
"國國民黨前主席馬","3","3"
"國民黨前主席馬英","3","3"
"民黨前主席馬英九","3","3"
"美国上市的中国公","3","3"
"国上市的中国公司","3","3"
"俄罗斯克里姆林宫","3","3"
"在卡塔尔世界杯的","3","3"
"他们在本地时间星","3","3"
"们在本地时间星期","3","3"
"撤销对中国华为公","3","3"
"销对中国华为公司","3","3"
"与俄罗斯和乌克兰","3","3"
"一位美国高级官员","3","3"
"史上规模最大的一","3","3"
"非物质文化遗产名","3","3"
"物质文化遗产名录","3","3"
"空间站天和核心舱","3","3"
"南省大理白族自治","3","3"
"省大理白族自治州","3","3"
"控制与预防中心星","3","3"
"制与预防中心星期","3","3"
"正常生产生活秩序","3","3"
"马来西亚福建社团","3","3"
"来西亚福建社团联","3","3"
"西亚福建社团联合","3","3"
"亚福建社团联合会","3","3"
"美国股指期货周日","3","3"
"法国财政部长勒梅","3","3"
"国财政部长勒梅尔","3","3"
"暴雨引发山体滑坡","3","3"
"集团旗下的富士康","3","3"
"在本地时间星期三","3","3"
"南太平洋岛国所罗","3","3"
"湾晶圆代工龙头厂","3","3"
"晶圆代工龙头厂台","3","3"
"圆代工龙头厂台积","3","3"
"代工龙头厂台积电","3","3"
"台积电和三星电子","3","3"
"占可支配收入的比","3","3"
"亚洲发往美国集装","3","3"
"洲发往美国集装箱","3","3"
"德国汽车制造商大","3","3"
"国汽车制造商大众","3","3"
"汽车制造商大众汽","3","3"
"车制造商大众汽车","3","3"
"半导体制造设备企","3","3"
"导体制造设备企业","3","3"
"芬兰和瑞典加入北","3","3"
"兰和瑞典加入北约","3","3"
"这家德国汽车制造","3","3"
"家德国汽车制造商","3","3"
"代表傅聰在會上表","3","3"
"表傅聰在會上表示","3","3"
"华盛顿里根国家机","3","3"
"盛顿里根国家机场","3","3"
"特斯拉的电池供应","3","3"
"冠病疫情持续延烧","3","3"
"一份联合声明中说","3","3"
"在未来几个月继续","3","3"
"号货运飞船的长征","3","3"
"货运飞船的长征七","3","3"
"运飞船的长征七号","3","3"
"飞船的长征七号遥","3","3"
"在中国文昌航天发","3","3"
"中国文昌航天发射","3","3"
"文昌航天发射场点","3","3"
"昌航天发射场点火","3","3"
"航天发射场点火发","3","3"
"天发射场点火发射","3","3"
"飞船与火箭成功分","3","3"
"船与火箭成功分离","3","3"
"团在香港上市的股","3","3"
"干散货船的租船费","3","3"
"商在香港上市的股","3","3"
"染性的奥密克戎变","3","3"
"的奥密克戎变异株","3","3"
"美国股市周一上涨","3","3"
"中国国际进口博览","3","3"
"国国际进口博览会","3","3"
"全球最大智能手机","3","3"
"新中双边合作联合","3","3"
"中双边合作联合委","3","3"
"双边合作联合委员","3","3"
"边合作联合委员会","3","3"
"中共第二十次全国","3","3"
"共第二十次全国代","3","3"
"半导体的全球份额","3","3"
"美国股市周二下跌","3","3"
"国上市的中概股周","3","3"
"字节跳动旗下的短","3","3"
"节跳动旗下的短视","3","3"
"跳动旗下的短视频","3","3"
"月份中国通用制造","3","3"
"份中国通用制造业","3","3"
"乌克兰战争爆发后","3","3"
"强制戴口罩的规定","3","3"
"家社交媒体公司的","3","3"
"的美国化妆品公司","3","3"
"美国化妆品公司露","3","3"
"国化妆品公司露华","3","3"
"化妆品公司露华浓","3","3"
"日本政府和日本央","3","3"
"本政府和日本央行","3","3"
"年来最严重的经济","3","3"
"国经济健康状况的","3","3"
"中共第二十届中央","3","3"
"工智能初创公司深","3","3"
"智能初创公司深度","3","3"
"能初创公司深度求","3","3"
"第二十届中央委员","3","3"
"中央军委副主席张","3","3"
"央军委副主席张又","3","3"
"军委副主席张又侠","3","3"
"京奥组委前理事高","3","3"
"组委前理事高桥治","3","3"
"委前理事高桥治之","3","3"
"有可比数据以来的","3","3"
"投票决定成立工会","3","3"
"中共二十大召开前","3","3"
"最重要的傳統節日","3","3"
"中国电动车公司蔚","3","3"
"国电动车公司蔚来","3","3"
"电动车公司蔚来汽","3","3"
"动车公司蔚来汽车","3","3"
"国电动车制造商小","3","3"
"电动车制造商小鹏","3","3"
"动车制造商小鹏汽","3","3"
"拉伯联合酋长国首","3","3"
"增长率预期下调至","3","3"
"泉卫星发射中心使","3","3"
"心使用长征二号丁","3","3"
"使用长征二号丁运","3","3"
"用长征二号丁运载","3","3"
"长征二号丁运载火","3","3"
"征二号丁运载火箭","3","3"
"研究团队开发出了","3","3"
"于今年晚些时候推","3","3"
"今年晚些时候推出","3","3"
"这家美国科技巨头","3","3"
"高盛集团和摩根大","3","3"
"盛集团和摩根大通","3","3"
"月以来最大单日百","3","3"
"亚洲新兴市场国家","3","3"
"央灾害应变中心统","3","3"
"灾害应变中心统计","3","3"
"国国家统计局周五","3","3"
"些令人印象深刻的","3","3"
"国规模以上工业增","3","3"
"在一定程度上取决","3","3"
"一定程度上取决于","3","3"
"由日本生产苹果手","3","3"
"日本生产苹果手机","3","3"
"以日本熊本为中心","3","3"
"日本熊本为中心画","3","3"
"本熊本为中心画一","3","3"
"熊本为中心画一个","3","3"
"有生产全世界大部","3","3"
"生产全世界大部分","3","3"
"和硕联合科技等的","3","3"
"硕联合科技等的工","3","3"
"联合科技等的工厂","3","3"
"合科技等的工厂的","3","3"
"科技等的工厂的上","3","3"
"技等的工厂的上海","3","3"
"的生产基地建在日","3","3"
"生产基地建在日本","3","3"
"产基地建在日本熊","3","3"
"基地建在日本熊本","3","3"
"地建在日本熊本也","3","3"
"建在日本熊本也应","3","3"
"在日本熊本也应该","3","3"
"日本熊本也应该不","3","3"
"本熊本也应该不足","3","3"
"熊本也应该不足为","3","3"
"本也应该不足为奇","3","3"
"种植及原产业部长","3","3"
"植及原产业部长拿","3","3"
"及原产业部长拿督","3","3"
"是晶片巨头英伟达","3","3"
"模型企业深度求索","3","3"
"以来最大幅度的加","3","3"
"来最大幅度的加息","3","3"
"亿美元收购交易的","3","3"
"与俄罗斯天然气工","3","3"
"与中国在南中国海","3","3"
"国在南中国海的主","3","3"
"油输出国组织及其","3","3"
"输出国组织及其盟","3","3"
"出国组织及其盟友","3","3"
"全球经济衰退担忧","3","3"
"进一步放宽边境管","3","3"
"一步放宽边境管制","3","3"
"正面临新一波疫情","3","3"
"向欧洲输送天然气","3","3"
"加快货币紧缩步伐","3","3"
"世界人工智能大会","3","3"
"苏联最后一任领导","3","3"
"联最后一任领导人","3","3"
"最后一任领导人戈","3","3"
"后一任领导人戈尔","3","3"
"一任领导人戈尔巴","3","3"
"任领导人戈尔巴乔","3","3"
"续第四个交易日下","3","3"
"第四个交易日下跌","3","3"
"大型干散货船的租","3","3"
"经济下行压力加大","3","3"
"调查以来的最低水","3","3"
"查以来的最低水平","3","3"
"在美联储主席鲍威","3","3"
"马来西亚国内贸易","3","3"
"来西亚国内贸易及","3","3"
"西亚国内贸易及消","3","3"
"亚国内贸易及消费","3","3"
"院议长佩洛西访问","3","3"
"议长佩洛西访问台","3","3"
"长佩洛西访问台湾","3","3"
"中国最大芯片制造","3","3"
"国最大芯片制造商","3","3"
"中国国家发展改革","3","3"
"国国家发展改革委","3","3"
"短期美国国债收益","3","3"
"大西洋公约组织的","3","3"
"美國蘋果公司首席","3","3"
"國蘋果公司首席執","3","3"
"电池巨头宁德时代","3","3"
"将每日入境人数上","3","3"
"每日入境人数上限","3","3"
"季节性因素调整后","3","3"
"冠病本土确诊病例","3","3"
"是中央气象台连续","3","3"
"信息通信研究机构","3","3"
"中国公民的学生签","3","3"
"国公民的学生签证","3","3"
"价位的纯电动汽车","3","3"
"日本产业技术综合","3","3"
"本产业技术综合研","3","3"
"产业技术综合研究","3","3"
"业技术综合研究所","3","3"
"位于佛罗里达州棕","3","3"
