"8gram","Frequency","Total Tweets"
"半导体和液晶面板","2","2"
"新加坡淡马锡控股","2","2"
"疫情爆发以来单日","2","2"
"员工重返办公室的","2","2"
"工重返办公室的时","2","2"
"重返办公室的时间","2","2"
"德尔塔变种冠病病","2","2"
"尔塔变种冠病病毒","2","2"
"在社交媒体上引发","2","2"
"西甲豪门巴塞罗那","2","2"
"消费者健康意识的","2","2"
"费者健康意识的提","2","2"
"者健康意识的提高","2","2"
"冠病毒德尔塔变种","2","2"
"变种病毒的传播力","2","2"
"国的新冠疫苗接种","2","2"
"详细报道稍后请见","2","2"
"是一种能使分子的","2","2"
"一种能使分子的长","2","2"
"种能使分子的长度","2","2"
"能使分子的长度和","2","2"
"使分子的长度和形","2","2"
"分子的长度和形状","2","2"
"子的长度和形状保","2","2"
"的长度和形状保持","2","2"
"长度和形状保持一","2","2"
"度和形状保持一致","2","2"
"和形状保持一致的","2","2"
"形状保持一致的技","2","2"
"状保持一致的技术","2","2"
"开创这一技术的日","2","2"
"创这一技术的日美","2","2"
"这一技术的日美研","2","2"
"一技术的日美研究","2","2"
"技术的日美研究人","2","2"
"术的日美研究人员","2","2"
"的日美研究人员被","2","2"
"日美研究人员被视","2","2"
"美研究人员被视为","2","2"
"研究人员被视为诺","2","2"
"究人员被视为诺奖","2","2"
"人员被视为诺奖候","2","2"
"员被视为诺奖候选","2","2"
"被视为诺奖候选人","2","2"
"从相关专利申请和","2","2"
"相关专利申请和论","2","2"
"关专利申请和论文","2","2"
"专利申请和论文数","2","2"
"利申请和论文数量","2","2"
"申请和论文数量来","2","2"
"请和论文数量来看","2","2"
"新冠疫情持续蔓延","2","2"
"冠疫情持续蔓延之","2","2"
"疫情持续蔓延之际","2","2"
"发布紧急事态宣言","2","2"
"日本半导体重振的","2","2"
"本半导体重振的关","2","2"
"半导体重振的关键","2","2"
"半导体微细化越来","2","2"
"导体微细化越来越","2","2"
"体微细化越来越难","2","2"
"日本在这一领域领","2","2"
"本在这一领域领先","2","2"
"个全球最大经济体","2","2"
"举行的东京奥运会","2","2"
"名员工确诊感染冠","2","2"
"员工确诊感染冠病","2","2"
"病毒德尔塔毒株的","2","2"
"毒德尔塔毒株的影","2","2"
"德尔塔毒株的影响","2","2"
"辉瑞疫苗在以色列","2","2"
"瑞疫苗在以色列预","2","2"
"疫苗在以色列预防","2","2"
"苗在以色列预防冠","2","2"
"在以色列预防冠病","2","2"
"以色列预防冠病感","2","2"
"色列预防冠病感染","2","2"
"列预防冠病感染的","2","2"
"预防冠病感染的有","2","2"
"防冠病感染的有效","2","2"
"冠病感染的有效率","2","2"
"病感染的有效率降","2","2"
"感染的有效率降至","2","2"
"奥运相关电视广告","2","2"
"这个波罗的海小国","2","2"
"的货币政策正常化","2","2"
"中国中部的河南省","2","2"
"国中部的河南省遭","2","2"
"中部的河南省遭到","2","2"
"部的河南省遭到极","2","2"
"的河南省遭到极端","2","2"
"暴雨引发的洪灾侵","2","2"
"雨引发的洪灾侵袭","2","2"
"全球芯片短缺正在","2","2"
"全接种新冠疫苗的","2","2"
"马上观赏完整视频","2","2"
"数十年来最严重的","2","2"
"工艺及革新部长凯","2","2"
"艺及革新部长凯利","2","2"
"及革新部长凯利说","2","2"
"年半导体制造设备","2","2"
"半导体制造设备市","2","2"
"导体制造设备市场","2","2"
"周首次申请失业救","2","2"
"单日新增病例持续","2","2"
"疫苗能提供多大的","2","2"
"苗能提供多大的保","2","2"
"能提供多大的保护","2","2"
"不同的疫苗怎么比","2","2"
"同的疫苗怎么比较","2","2"
"有乘客初步确诊冠","2","2"
"乘客初步确诊冠病","2","2"
"来的最大单日涨幅","2","2"
"运营优衣库的日本","2","2"
"营优衣库的日本迅","2","2"
"优衣库的日本迅销","2","2"
"德尔塔变异毒株的","2","2"
"个人电脑用液晶面","2","2"
"人电脑用液晶面板","2","2"
"的意大利和英格兰","2","2"
"东京都知事小池百","2","2"
"京都知事小池百合","2","2"
"都知事小池百合子","2","2"
"科学节目主持人迈","2","2"
"学节目主持人迈克","2","2"
"节目主持人迈克尔","2","2"
"疫情指挥中心昨天","2","2"
"意大利在点球大战","2","2"
"冠病疫情日益严重","2","2"
"新加坡国立大学苏","2","2"
"加坡国立大学苏瑞","2","2"
"坡国立大学苏瑞福","2","2"
"国立大学苏瑞福公","2","2"
"立大学苏瑞福公共","2","2"
"大学苏瑞福公共卫","2","2"
"学苏瑞福公共卫生","2","2"
"苏瑞福公共卫生学","2","2"
"瑞福公共卫生学院","2","2"
"福公共卫生学院院","2","2"
"公共卫生学院院长","2","2"
"共卫生学院院长张","2","2"
"卫生学院院长张毅","2","2"
"生学院院长张毅颖","2","2"
"学院院长张毅颖教","2","2"
"院院长张毅颖教授","2","2"
"遵守标准作业程序","2","2"
"新冠病毒疫情扩大","2","2"
"应用或携手防疫器","2","2"
"与苏伊士运河管理","2","2"
"伊士运河管理局达","2","2"
"士运河管理局达成","2","2"
"运河管理局达成赔","2","2"
"河管理局达成赔偿","2","2"
"管理局达成赔偿协","2","2"
"理局达成赔偿协议","2","2"
"日本前首相安倍晋","2","2"
"本前首相安倍晋三","2","2"
"天的单日新增病例","2","2"
"的单日新增病例超","2","2"
"正面临新一波疫情","2","2"
"的半导体制造设备","2","2"
"年期美债收益率上","2","2"
"泰国旅游胜地普吉","2","2"
"国旅游胜地普吉岛","2","2"
"创下疫情爆发以来","2","2"
"于半导体制造设备","2","2"
"使用合力追踪应用","2","2"
"红山景巴刹与熟食","2","2"
"山景巴刹与熟食中","2","2"
"景巴刹与熟食中心","2","2"
"间担任菲律宾总统","2","2"
"净零排放的路线图","2","2"
"菲律宾前总统阿基","2","2"
"律宾前总统阿基诺","2","2"
"奎松市的一家医院","2","2"
"通过拆解查看各种","2","2"
"过拆解查看各种设","2","2"
"拆解查看各种设备","2","2"
"解查看各种设备的","2","2"
"查看各种设备的内","2","2"
"看各种设备的内部","2","2"
"各种设备的内部情","2","2"
"种设备的内部情况","2","2"
"可以看到技术人员","2","2"
"以看到技术人员在","2","2"
"看到技术人员在控","2","2"
"到技术人员在控制","2","2"
"技术人员在控制成","2","2"
"术人员在控制成本","2","2"
"人员在控制成本的","2","2"
"员在控制成本的同","2","2"
"在控制成本的同时","2","2"
"控制成本的同时实","2","2"
"制成本的同时实现","2","2"
"成本的同时实现高","2","2"
"本的同时实现高功","2","2"
"的同时实现高功能","2","2"
"以及零部件配置等","2","2"
"及零部件配置等各","2","2"
"零部件配置等各方","2","2"
"部件配置等各方面","2","2"
"件配置等各方面的","2","2"
"配置等各方面的苦","2","2"
"置等各方面的苦心","2","2"
"也可以看到各国在","2","2"
"可以看到各国在电","2","2"
"以看到各国在电子","2","2"
"看到各国在电子零","2","2"
"到各国在电子零部","2","2"
"各国在电子零部件","2","2"
"国在电子零部件领","2","2"
"在电子零部件领域","2","2"
"电子零部件领域的","2","2"
"子零部件领域的优","2","2"
"零部件领域的优劣","2","2"
"议员和监管机构正","2","2"
"在很长一段时间内","2","2"
"在运动员的防疫措","2","2"
"运动员的防疫措施","2","2"
"动员的防疫措施方","2","2"
"员的防疫措施方面","2","2"
"计划阻断运动员与","2","2"
"划阻断运动员与外","2","2"
"阻断运动员与外界","2","2"
"断运动员与外界的","2","2"
"运动员与外界的接","2","2"
"动员与外界的接触","2","2"
"不允许前往景点和","2","2"
"允许前往景点和外","2","2"
"许前往景点和外出","2","2"
"前往景点和外出就","2","2"
"往景点和外出就餐","2","2"
"原则上禁止运动员","2","2"
"则上禁止运动员使","2","2"
"上禁止运动员使用","2","2"
"禁止运动员使用公","2","2"
"止运动员使用公共","2","2"
"运动员使用公共交","2","2"
"动员使用公共交通","2","2"
"员使用公共交通工","2","2"
"使用公共交通工具","2","2"
"丰田申请数全球第","2","2"
"田申请数全球第一","2","2"
"为脱碳社会作出贡","2","2"
"脱碳社会作出贡献","2","2"
"碳社会作出贡献的","2","2"
"社会作出贡献的全","2","2"
"会作出贡献的全球","2","2"
"作出贡献的全球专","2","2"
"出贡献的全球专利","2","2"
"贡献的全球专利申","2","2"
"献的全球专利申请","2","2"
"的全球专利申请数","2","2"
"全球专利申请数量","2","2"
"球专利申请数量上","2","2"
"但专利综合实力却","2","2"
"专利综合实力却排","2","2"
"利综合实力却排在","2","2"
"综合实力却排在三","2","2"
"合实力却排在三星","2","2"
"实力却排在三星之","2","2"
"力却排在三星之后","2","2"
"在综合实力排名前","2","2"
"中国企业有显著提","2","2"
"国企业有显著提升","2","2"
"而受到越来越多的","2","2"
"加大了对加密货币","2","2"
"中国页岩油勘探获","2","2"
"国页岩油勘探获重","2","2"
"页岩油勘探获重大","2","2"
"岩油勘探获重大突","2","2"
"油勘探获重大突破","2","2"
"中国石油天然气集","2","2"
"国石油天然气集团","2","2"
"石油天然气集团宣","2","2"
"油天然气集团宣布","2","2"
"亿吨的页岩油整装","2","2"
"吨的页岩油整装大","2","2"
"的页岩油整装大油","2","2"
"页岩油整装大油田","2","2"
"成为中国目前探明","2","2"
"为中国目前探明储","2","2"
"中国目前探明储量","2","2"
"国目前探明储量规","2","2"
"目前探明储量规模","2","2"
"前探明储量规模最","2","2"
"探明储量规模最大","2","2"
"明储量规模最大的","2","2"
"储量规模最大的页","2","2"
"量规模最大的页岩","2","2"
"规模最大的页岩油","2","2"
"模最大的页岩油大","2","2"
"最大的页岩油大油","2","2"
"大的页岩油大油田","2","2"
"有史以来最严重的","2","2"
"人口接种了至少一","2","2"
"口接种了至少一剂","2","2"
"接种了至少一剂冠","2","2"
"种了至少一剂冠病","2","2"
"了至少一剂冠病疫","2","2"
"至少一剂冠病疫苗","2","2"
"大坂直美宣布退出","2","2"
"对一个共同的威胁","2","2"
"机进入台湾西南空","2","2"
"进入台湾西南空域","2","2"
"币和其他加密货币","2","2"
"新加坡将逐步重返","2","2"
"加坡将逐步重返高","2","2"
"坡将逐步重返高警","2","2"
"将逐步重返高警戒","2","2"
"逐步重返高警戒解","2","2"
"步重返高警戒解封","2","2"
"重返高警戒解封第","2","2"
"返高警戒解封第三","2","2"
"高警戒解封第三阶","2","2"
"警戒解封第三阶段","2","2"
"社交聚会和登门访","2","2"
"交聚会和登门访客","2","2"
"聚会和登门访客人","2","2"
"会和登门访客人数","2","2"
"和登门访客人数将","2","2"
"登门访客人数将从","2","2"
"门访客人数将从最","2","2"
"访客人数将从最多","2","2"
"客人数将从最多两","2","2"
"人数将从最多两人","2","2"
"数将从最多两人增","2","2"
"将从最多两人增至","2","2"
"从最多两人增至五","2","2"
"最多两人增至五人","2","2"
"若疫情局势持续受","2","2"
"疫情局势持续受控","2","2"
"日起也将恢复更多","2","2"
"起也将恢复更多风","2","2"
"也将恢复更多风险","2","2"
"将恢复更多风险较","2","2"
"恢复更多风险较高","2","2"
"复更多风险较高的","2","2"
"更多风险较高的活","2","2"
"多风险较高的活动","2","2"
"唱片公司还是艺人","2","2"
"流媒体及社交平台","2","2"
"媒体及社交平台正","2","2"
"体及社交平台正在","2","2"
"及社交平台正在改","2","2"
"社交平台正在改变","2","2"
"交平台正在改变音","2","2"
"平台正在改变音乐","2","2"
"台正在改变音乐产","2","2"
"正在改变音乐产业","2","2"
"在改变音乐产业环","2","2"
"改变音乐产业环境","2","2"
"唱片公司和分销商","2","2"
"片公司和分销商应","2","2"
"公司和分销商应该","2","2"
"司和分销商应该如","2","2"
"和分销商应该如何","2","2"
"分销商应该如何适","2","2"
"销商应该如何适应","2","2"
"商应该如何适应这","2","2"
"应该如何适应这个","2","2"
"该如何适应这个快","2","2"
"如何适应这个快速","2","2"
"何适应这个快速变","2","2"
"适应这个快速变化","2","2"
"应这个快速变化的","2","2"
"这个快速变化的行","2","2"
"个快速变化的行业","2","2"
"他们又是如何赚钱","2","2"
"们又是如何赚钱的","2","2"
"中国银保监会主席","2","2"
"国银保监会主席郭","2","2"
"银保监会主席郭树","2","2"
"保监会主席郭树清","2","2"
"日本要借全固态电","2","2"
"本要借全固态电池","2","2"
"要借全固态电池谋","2","2"
"借全固态电池谋求","2","2"
"全固态电池谋求逆","2","2"
"固态电池谋求逆转","2","2"
"锂离子电池由索尼","2","2"
"离子电池由索尼集","2","2"
"子电池由索尼集团","2","2"
"电池由索尼集团于","2","2"
"是源自日本的技术","2","2"
"但目前海外企业势","2","2"
"目前海外企业势头","2","2"
"前海外企业势头强","2","2"
"海外企业势头强劲","2","2"
"宁德时代在车载锂","2","2"
"德时代在车载锂电","2","2"
"时代在车载锂电池","2","2"
"代在车载锂电池领","2","2"
"在车载锂电池领域","2","2"
"车载锂电池领域独","2","2"
"载锂电池领域独占","2","2"
"锂电池领域独占鳌","2","2"
"电池领域独占鳌头","2","2"
"日企发力新一代电","2","2"
"企发力新一代电池","2","2"
"发力新一代电池技","2","2"
"力新一代电池技术","2","2"
"日立造船的全固态","2","2"
"立造船的全固态电","2","2"
"造船的全固态电池","2","2"
"船的全固态电池容","2","2"
"的全固态电池容量","2","2"
"全固态电池容量达","2","2"
"固态电池容量达到","2","2"
"态电池容量达到全","2","2"
"电池容量达到全球","2","2"
"池容量达到全球最","2","2"
"容量达到全球最大","2","2"
"量达到全球最大级","2","2"
"达到全球最大级别","2","2"
"科学家成功研发一","2","2"
"学家成功研发一款","2","2"
"家成功研发一款带","2","2"
"成功研发一款带过","2","2"
"功研发一款带过滤","2","2"
"研发一款带过滤与","2","2"
"发一款带过滤与纳","2","2"
"一款带过滤与纳米","2","2"
"款带过滤与纳米抗","2","2"
"带过滤与纳米抗菌","2","2"
"过滤与纳米抗菌双","2","2"
"滤与纳米抗菌双重","2","2"
"与纳米抗菌双重防","2","2"
"纳米抗菌双重防护","2","2"
"米抗菌双重防护的","2","2"
"抗菌双重防护的可","2","2"
"菌双重防护的可重","2","2"
"双重防护的可重复","2","2"
"重防护的可重复使","2","2"
"防护的可重复使用","2","2"
"护的可重复使用口","2","2"
"的可重复使用口罩","2","2"
"保持佩戴者呼吸顺","2","2"
"持佩戴者呼吸顺畅","2","2"
"佩戴者呼吸顺畅的","2","2"
"戴者呼吸顺畅的同","2","2"
"者呼吸顺畅的同时","2","2"
"秒内杀死有害细菌","2","2"
"新增冠病社区病例","2","2"
"援引未具名消息人","2","2"
"引未具名消息人士","2","2"
"未具名消息人士的","2","2"
"具名消息人士的话","2","2"
"总数已达千万级别","2","2"
"可能会在一条没有","2","2"
"能会在一条没有希","2","2"
"会在一条没有希望","2","2"
"在一条没有希望的","2","2"
"一条没有希望的道","2","2"
"条没有希望的道路","2","2"
"韩国零部件占比提","2","2"
"国零部件占比提升","2","2"
"按价格计算韩企零","2","2"
"价格计算韩企零部","2","2"
"格计算韩企零部件","2","2"
"计算韩企零部件占","2","2"
"全面采用价格较高","2","2"
"面采用价格较高的","2","2"
"年将实现全部新车","2","2"
"将实现全部新车电","2","2"
"实现全部新车电动","2","2"
"现全部新车电动化","2","2"
"本田将在北美推出","2","2"
"款大型纯电动汽车","2","2"
"年推出新款纯电动","2","2"
"推出新款纯电动汽","2","2"
"出新款纯电动汽车","2","2"
"旬上海发往美国西","2","2"
"往美国西海岸的运","2","2"
"女性比男性更易失","2","2"
"性比男性更易失业","2","2"
"年轻人比已进入劳","2","2"
"轻人比已进入劳动","2","2"
"人比已进入劳动市","2","2"
"比已进入劳动市场","2","2"
"已进入劳动市场的","2","2"
"进入劳动市场的人","2","2"
"入劳动市场的人更","2","2"
"劳动市场的人更受","2","2"
"动市场的人更受危","2","2"
"市场的人更受危机","2","2"
"场的人更受危机影","2","2"
"的人更受危机影响","2","2"
"全球过度依赖台积","2","2"
"球过度依赖台积电","2","2"
"过度依赖台积电的","2","2"
"度依赖台积电的风","2","2"
"依赖台积电的风险","2","2"
"赖台积电的风险在","2","2"
"台积电的风险在加","2","2"
"积电的风险在加强","2","2"
"台积电提出巨额投","2","2"
"积电提出巨额投资","2","2"
"电提出巨额投资计","2","2"
"提出巨额投资计划","2","2"
"可以认为是技术开","2","2"
"以认为是技术开发","2","2"
"认为是技术开发上","2","2"
"为是技术开发上有","2","2"
"是技术开发上有了","2","2"
"技术开发上有了眉","2","2"
"术开发上有了眉目","2","2"
"为何台积电在技术","2","2"
"何台积电在技术上","2","2"
"台积电在技术上领","2","2"
"积电在技术上领先","2","2"
"电在技术上领先世","2","2"
"在技术上领先世界","2","2"
"技术上领先世界呢","2","2"
"与竞争对手三星相","2","2"
"竞争对手三星相比","2","2"
"在技术以外存在决","2","2"
"技术以外存在决定","2","2"
"术以外存在决定性","2","2"
"以外存在决定性的","2","2"
"外存在决定性的结","2","2"
"存在决定性的结构","2","2"
"在决定性的结构性","2","2"
"决定性的结构性原","2","2"
"定性的结构性原因","2","2"
"世界将不得不进一","2","2"
"界将不得不进一步","2","2"
"将不得不进一步加","2","2"
"不得不进一步加强","2","2"
"得不进一步加强对","2","2"
"不进一步加强对台","2","2"
"进一步加强对台积","2","2"
"一步加强对台积电","2","2"
"步加强对台积电的","2","2"
"加强对台积电的依","2","2"
"强对台积电的依存","2","2"
"目前主流的尖端产","2","2"
"前主流的尖端产品","2","2"
"福利部长陈时中昨","2","2"
"利部长陈时中昨天","2","2"
"食品和饮料产品达","2","2"
"品和饮料产品达不","2","2"
"和饮料产品达不到","2","2"
"在台湾本土新冠疫","2","2"
"台湾本土新冠疫情","2","2"
"湾本土新冠疫情持","2","2"
"本土新冠疫情持续","2","2"
"整体出口额同比增","2","2"
"体出口额同比增长","2","2"
"单日新增病例连续","2","2"
"其中一些知情人士","2","2"
"在接种新冠疫苗后","2","2"
"对变异新冠病毒的","2","2"
"不要前往日本旅行","2","2"
"大规模新冠疫苗接","2","2"
"规模新冠疫苗接种","2","2"
"台湾本土病例暴增","2","2"
"即追加上周每天的","2","2"
"追加上周每天的病","2","2"
"加上周每天的病例","2","2"
"和阿斯利康新冠疫","2","2"
"用加密货币支付赎","2","2"
"加密货币支付赎金","2","2"
"密货币支付赎金的","2","2"
"打击比特币挖矿和","2","2"
"击比特币挖矿和交","2","2"
"一项最新民调显示","2","2"
"的车载半导体不足","2","2"
"万剂阿斯利康疫苗","2","2"
"冠病疫情形势严峻","2","2"
"卫生总监诺希山说","2","2"
"引发台湾是否在防","2","2"
"发台湾是否在防疫","2","2"
"台湾是否在防疫意","2","2"
"湾是否在防疫意识","2","2"
"是否在防疫意识上","2","2"
"两岸对峙的核心是","2","2"
"中国政府将台湾视","2","2"
"国政府将台湾视为","2","2"
"政府将台湾视为其","2","2"
"府将台湾视为其主","2","2"
"将台湾视为其主权","2","2"
"台湾视为其主权下","2","2"
"湾视为其主权下的","2","2"
"视为其主权下的一","2","2"
"为其主权下的一个","2","2"
"其主权下的一个省","2","2"
"主权下的一个省级","2","2"
"权下的一个省级行","2","2"
"下的一个省级行政","2","2"
"的一个省级行政区","2","2"
"终将回归成为中国","2","2"
"将回归成为中国的","2","2"
"回归成为中国的一","2","2"
"归成为中国的一部","2","2"
"成为中国的一部分","2","2"
"很多台湾人并不赞","2","2"
"多台湾人并不赞同","2","2"
"台湾人并不赞同这","2","2"
"湾人并不赞同这一","2","2"
"人并不赞同这一点","2","2"
"无论是否有正式宣","2","2"
"论是否有正式宣布","2","2"
"是否有正式宣布独","2","2"
"否有正式宣布独立","2","2"
"自己实际上已经是","2","2"
"己实际上已经是另","2","2"
"实际上已经是另外","2","2"
"际上已经是另外一","2","2"
"上已经是另外一个","2","2"
"已经是另外一个国","2","2"
"经是另外一个国家","2","2"
"起本土冠病确诊病","2","2"
"本土冠病确诊病例","2","2"
"防疫警戒升至第三","2","2"
"疫警戒升至第三级","2","2"
"市民外出都须戴口","2","2"
"民外出都须戴口罩","2","2"
"所有营业和公共场","2","2"
"有营业和公共场所","2","2"
"营业和公共场所关","2","2"
"业和公共场所关闭","2","2"
"停止室内五人以上","2","2"
"合并净利润同比增","2","2"
"并净利润同比增长","2","2"
"将在珠穆朗玛峰峰","2","2"
"在珠穆朗玛峰峰顶","2","2"
"珠穆朗玛峰峰顶设","2","2"
"穆朗玛峰峰顶设立","2","2"
"朗玛峰峰顶设立一","2","2"
"玛峰峰顶设立一条","2","2"
"以防止中国登山者","2","2"
"防止中国登山者与","2","2"
"止中国登山者与来","2","2"
"中国登山者与来自","2","2"
"国登山者与来自尼","2","2"
"登山者与来自尼泊","2","2"
"山者与来自尼泊尔","2","2"
"者与来自尼泊尔的","2","2"
"与来自尼泊尔的登","2","2"
"来自尼泊尔的登山","2","2"
"自尼泊尔的登山者","2","2"
"尼泊尔的登山者在","2","2"
"泊尔的登山者在世","2","2"
"尔的登山者在世界","2","2"
"的登山者在世界之","2","2"
"登山者在世界之巅","2","2"
"国药集团的新冠疫","2","2"
"药集团的新冠疫苗","2","2"
"受到越来越多的批","2","2"
"到越来越多的批评","2","2"
"月亚洲发往美国的","2","2"
"亚洲发往美国的海","2","2"
"洲发往美国的海上","2","2"
"国的海上集装箱运","2","2"
"的海上集装箱运输","2","2"
"的累计冠病确诊病","2","2"
"累计冠病确诊病例","2","2"
"豁免新冠疫苗专利","2","2"
"台湾外交部发言人","2","2"
"湾外交部发言人欧","2","2"
"外交部发言人欧江","2","2"
"交部发言人欧江安","2","2"
"泰国第三波冠病疫","2","2"
"国第三波冠病疫情","2","2"
"一名中国籍男子驾","2","2"
"名中国籍男子驾橡","2","2"
"中国籍男子驾橡皮","2","2"
"国籍男子驾橡皮艇","2","2"
"籍男子驾橡皮艇从","2","2"
"男子驾橡皮艇从福","2","2"
"子驾橡皮艇从福建","2","2"
"驾橡皮艇从福建偷","2","2"
"橡皮艇从福建偷渡","2","2"
"皮艇从福建偷渡到","2","2"
"艇从福建偷渡到台","2","2"
"从福建偷渡到台湾","2","2"
"海巡及岸巡的监控","2","2"
"直至上岸后才被港","2","2"
"至上岸后才被港口","2","2"
"上岸后才被港口工","2","2"
"岸后才被港口工人","2","2"
"后才被港口工人发","2","2"
"才被港口工人发现","2","2"
"被港口工人发现报","2","2"
"港口工人发现报警","2","2"
"该男子声称偷渡是","2","2"
"男子声称偷渡是为","2","2"
"子声称偷渡是为了","2","2"
"声称偷渡是为了投","2","2"
"称偷渡是为了投奔","2","2"
"偷渡是为了投奔自","2","2"
"渡是为了投奔自由","2","2"
"台湾国防部长邱国","2","2"
"湾国防部长邱国正","2","2"
"国防部长邱国正表","2","2"
"防部长邱国正表示","2","2"
"财年合并净利润预","2","2"
"年合并净利润预计","2","2"
"合并净利润预计比","2","2"
"并净利润预计比上","2","2"
"净利润预计比上财","2","2"
"利润预计比上财年","2","2"
"润预计比上财年增","2","2"
"预计比上财年增加","2","2"
"虽然存在疫情宅家","2","2"
"然存在疫情宅家需","2","2"
"存在疫情宅家需求","2","2"
"在疫情宅家需求这","2","2"
"疫情宅家需求这一","2","2"
"情宅家需求这一有","2","2"
"宅家需求这一有利","2","2"
"家需求这一有利因","2","2"
"需求这一有利因素","2","2"
"但获得高收益的原","2","2"
"获得高收益的原因","2","2"
"得高收益的原因不","2","2"
"高收益的原因不止","2","2"
"收益的原因不止于","2","2"
"益的原因不止于此","2","2"
"其成功大致可以分","2","2"
