"8gram","Frequency","Total Tweets"
"成功大致可以分为","2","2"
"功大致可以分为三","2","2"
"大致可以分为三个","2","2"
"致可以分为三个阶","2","2"
"可以分为三个阶段","2","2"
"以分为三个阶段来","2","2"
"分为三个阶段来分","2","2"
"为三个阶段来分析","2","2"
"首先是投放让用户","2","2"
"先是投放让用户着","2","2"
"是投放让用户着迷","2","2"
"投放让用户着迷的","2","2"
"放让用户着迷的游","2","2"
"让用户着迷的游戏","2","2"
"用户着迷的游戏软","2","2"
"户着迷的游戏软件","2","2"
"造成危害的概率极","2","2"
"成危害的概率极低","2","2"
"昨天的新增确诊病","2","2"
"天的新增确诊病例","2","2"
"越来越依赖中国的","2","2"
"紧急事态宣言期限","2","2"
"疫苗的另一场全球","2","2"
"苗的另一场全球竞","2","2"
"的另一场全球竞争","2","2"
"是在入境时通过手","2","2"
"在入境时通过手机","2","2"
"入境时通过手机查","2","2"
"境时通过手机查看","2","2"
"时通过手机查看接","2","2"
"通过手机查看接种","2","2"
"过手机查看接种情","2","2"
"手机查看接种情况","2","2"
"机查看接种情况的","2","2"
"查看接种情况的机","2","2"
"看接种情况的机制","2","2"
"中国等正为实用化","2","2"
"国等正为实用化而","2","2"
"等正为实用化而行","2","2"
"正为实用化而行动","2","2"
"为相关国际组织制","2","2"
"相关国际组织制定","2","2"
"关国际组织制定国","2","2"
"国际组织制定国际","2","2"
"际组织制定国际标","2","2"
"组织制定国际标准","2","2"
"织制定国际标准提","2","2"
"制定国际标准提供","2","2"
"定国际标准提供技","2","2"
"国际标准提供技术","2","2"
"际标准提供技术的","2","2"
"标准提供技术的是","2","2"
"准提供技术的是一","2","2"
"提供技术的是一家","2","2"
"供技术的是一家日","2","2"
"技术的是一家日企","2","2"
"但日本的相关部门","2","2"
"日本的相关部门等","2","2"
"本的相关部门等却","2","2"
"的相关部门等却对","2","2"
"相关部门等却对参","2","2"
"关部门等却对参与","2","2"
"部门等却对参与标","2","2"
"门等却对参与标准","2","2"
"等却对参与标准制","2","2"
"却对参与标准制定","2","2"
"对参与标准制定兴","2","2"
"参与标准制定兴趣","2","2"
"与标准制定兴趣不","2","2"
"标准制定兴趣不大","2","2"
"与中国的投资协议","2","2"
"美国财政部长耶伦","2","2"
"斯达克综合指数下","2","2"
"达克综合指数下跌","2","2"
"证券交易委员会表","2","2"
"券交易委员会表示","2","2"
"一些受影响最严重","2","2"
"中国大陆男子自称","2","2"
"巴菲特旗下的伯克","2","2"
"菲特旗下的伯克希","2","2"
"特旗下的伯克希尔","2","2"
"旗下的伯克希尔哈","2","2"
"第一财季净利润为","2","2"
"国冠病疫苗接种计","2","2"
"全球出生人数因疫","2","2"
"球出生人数因疫情","2","2"
"出生人数因疫情锐","2","2"
"生人数因疫情锐减","2","2"
"欧洲国家的出生人","2","2"
"洲国家的出生人数","2","2"
"国家的出生人数下","2","2"
"家的出生人数下降","2","2"
"年人口增长率预计","2","2"
"人口增长率预计将","2","2"
"口增长率预计将放","2","2"
"增长率预计将放缓","2","2"
"长率预计将放缓至","2","2"
"年以来的最低水平","2","2"
"经济危机后曾出现","2","2"
"济危机后曾出现婴","2","2"
"危机后曾出现婴儿","2","2"
"机后曾出现婴儿潮","2","2"
"而如今年轻人的就","2","2"
"如今年轻人的就业","2","2"
"今年轻人的就业受","2","2"
"年轻人的就业受到","2","2"
"轻人的就业受到影","2","2"
"人的就业受到影响","2","2"
"日企小型化技术领","2","2"
"企小型化技术领先","2","2"
"要求手机具备先进","2","2"
"求手机具备先进性","2","2"
"手机具备先进性能","2","2"
"在手机用的锂电池","2","2"
"手机用的锂电池领","2","2"
"机用的锂电池领域","2","2"
"在多层陶瓷电容器","2","2"
"多层陶瓷电容器领","2","2"
"层陶瓷电容器领域","2","2"
"村田制作所拥有优","2","2"
"田制作所拥有优势","2","2"
"虽然日本企业有技","2","2"
"然日本企业有技术","2","2"
"日本企业有技术优","2","2"
"本企业有技术优势","2","2"
"但风险也越来越大","2","2"
"年来最严重的干旱","2","2"
"部发言人赵立坚在","2","2"
"以色列总理内塔尼","2","2"
"色列总理内塔尼亚","2","2"
"列总理内塔尼亚胡","2","2"
"纳米产品是全球最","2","2"
"米产品是全球最为","2","2"
"产品是全球最为短","2","2"
"品是全球最为短缺","2","2"
"是全球最为短缺的","2","2"
"全球最为短缺的半","2","2"
"球最为短缺的半导","2","2"
"最为短缺的半导体","2","2"
"为短缺的半导体之","2","2"
"短缺的半导体之一","2","2"
"量产时的制造成本","2","2"
"产时的制造成本有","2","2"
"时的制造成本有望","2","2"
"的制造成本有望低","2","2"
"制造成本有望低于","2","2"
"造成本有望低于锂","2","2"
"主流的锂离子电池","2","2"
"为什么印度没能防","2","2"
"什么印度没能防住","2","2"
"么印度没能防住致","2","2"
"印度没能防住致命","2","2"
"度没能防住致命的","2","2"
"没能防住致命的第","2","2"
"能防住致命的第二","2","2"
"防住致命的第二波","2","2"
"日新增病例连续两","2","2"
"提供酒类的餐饮店","2","2"
"紧急事态宣言解除","2","2"
"收盘价为每蒲式耳","2","2"
"年的乍得总统代比","2","2"
"的乍得总统代比亲","2","2"
"乍得总统代比亲自","2","2"
"得总统代比亲自与","2","2"
"总统代比亲自与反","2","2"
"统代比亲自与反叛","2","2"
"代比亲自与反叛武","2","2"
"比亲自与反叛武装","2","2"
"亲自与反叛武装交","2","2"
"自与反叛武装交战","2","2"
"与反叛武装交战期","2","2"
"反叛武装交战期间","2","2"
"叛武装交战期间阵","2","2"
"武装交战期间阵亡","2","2"
"给这位处非洲北部","2","2"
"这位处非洲北部中","2","2"
"位处非洲北部中央","2","2"
"处非洲北部中央的","2","2"
"非洲北部中央的国","2","2"
"洲北部中央的国家","2","2"
"北部中央的国家留","2","2"
"部中央的国家留下","2","2"
"中央的国家留下巨","2","2"
"央的国家留下巨大","2","2"
"的国家留下巨大的","2","2"
"国家留下巨大的政","2","2"
"家留下巨大的政治","2","2"
"留下巨大的政治缺","2","2"
"下巨大的政治缺口","2","2"
"丰田是这样顶住半","2","2"
"田是这样顶住半导","2","2"
"是这样顶住半导体","2","2"
"这样顶住半导体不","2","2"
"样顶住半导体不足","2","2"
"顶住半导体不足影","2","2"
"住半导体不足影响","2","2"
"半导体不足影响的","2","2"
"半导体短缺导致大","2","2"
"导体短缺导致大众","2","2"
"体短缺导致大众和","2","2"
"短缺导致大众和通","2","2"
"缺导致大众和通用","2","2"
"导致大众和通用等","2","2"
"致大众和通用等大","2","2"
"大众和通用等大型","2","2"
"众和通用等大型汽","2","2"
"和通用等大型汽车","2","2"
"通用等大型汽车厂","2","2"
"用等大型汽车厂商","2","2"
"等大型汽车厂商相","2","2"
"大型汽车厂商相继","2","2"
"型汽车厂商相继减","2","2"
"汽车厂商相继减产","2","2"
"月前不会产生巨大","2","2"
"前不会产生巨大影","2","2"
"不会产生巨大影响","2","2"
"东日本大地震的教","2","2"
"日本大地震的教训","2","2"
"本大地震的教训而","2","2"
"大地震的教训而做","2","2"
"地震的教训而做的","2","2"
"震的教训而做的一","2","2"
"的教训而做的一个","2","2"
"教训而做的一个改","2","2"
"训而做的一个改变","2","2"
"而做的一个改变在","2","2"
"做的一个改变在其","2","2"
"的一个改变在其中","2","2"
"一个改变在其中发","2","2"
"个改变在其中发挥","2","2"
"改变在其中发挥了","2","2"
"变在其中发挥了作","2","2"
"在其中发挥了作用","2","2"
"中国大量购买二手","2","2"
"国大量购买二手半","2","2"
"大量购买二手半导","2","2"
"量购买二手半导体","2","2"
"购买二手半导体设","2","2"
"买二手半导体设备","2","2"
"二手半导体设备的","2","2"
"手半导体设备的价","2","2"
"半导体设备的价格","2","2"
"导体设备的价格正","2","2"
"体设备的价格正持","2","2"
"设备的价格正持续","2","2"
"备的价格正持续上","2","2"
"的价格正持续上升","2","2"
"多家日本二手业者","2","2"
"家日本二手业者表","2","2"
"日本二手业者表示","2","2"
"本二手业者表示在","2","2"
"二手业者表示在最","2","2"
"手业者表示在最近","2","2"
"年里平均上涨了近","2","2"
"中国半导体厂商大","2","2"
"国半导体厂商大量","2","2"
"半导体厂商大量购","2","2"
"导体厂商大量购买","2","2"
"最尖端半导体设备","2","2"
"尖端半导体设备采","2","2"
"端半导体设备采购","2","2"
"半导体设备采购受","2","2"
"导体设备采购受到","2","2"
"体设备采购受到美","2","2"
"设备采购受到美国","2","2"
"备采购受到美国限","2","2"
"采购受到美国限制","2","2"
"中国相关企业似乎","2","2"
"国相关企业似乎正","2","2"
"相关企业似乎正在","2","2"
"关企业似乎正在采","2","2"
"企业似乎正在采购","2","2"
"业似乎正在采购上","2","2"
"似乎正在采购上一","2","2"
"乎正在采购上一代","2","2"
"正在采购上一代设","2","2"
"在采购上一代设备","2","2"
"新英格兰医学杂志","2","2"
"官房长官加藤胜信","2","2"
"东京奥运会和残奥","2","2"
"京奥运会和残奥会","2","2"
"斯利康新冠疫苗接","2","2"
"利康新冠疫苗接种","2","2"
"康新冠疫苗接种者","2","2"
"的半导体制造能力","2","2"
"半导体制造能力占","2","2"
"导体制造能力占全","2","2"
"体制造能力占全球","2","2"
"制造能力占全球的","2","2"
"正在稳步提升实力","2","2"
"福岛第一核电站事","2","2"
"岛第一核电站事故","2","2"
"福岛核处理水排入","2","2"
"中国驻美国大使崔","2","2"
"国驻美国大使崔天","2","2"
"驻美国大使崔天凯","2","2"
"美国大使崔天凯强","2","2"
"国大使崔天凯强调","2","2"
"中美关系正面临何","2","2"
"美关系正面临何去","2","2"
"关系正面临何去何","2","2"
"系正面临何去何从","2","2"
"正面临何去何从的","2","2"
"面临何去何从的关","2","2"
"临何去何从的关键","2","2"
"何去何从的关键选","2","2"
"去何从的关键选择","2","2"
"双方更应继承和发","2","2"
"方更应继承和发扬","2","2"
"所承载的相互尊重","2","2"
"寻求合作共赢的相","2","2"
"求合作共赢的相处","2","2"
"合作共赢的相处之","2","2"
"作共赢的相处之道","2","2"
"后工序的组装生产","2","2"
"工序的组装生产线","2","2"
"在香港上市的股票","2","2"
"罕见血栓应被列为","2","2"
"见血栓应被列为牛","2","2"
"血栓应被列为牛津","2","2"
"阿斯利康疫苗的一","2","2"
"斯利康疫苗的一种","2","2"
"利康疫苗的一种非","2","2"
"康疫苗的一种非常","2","2"
"疫苗的一种非常罕","2","2"
"苗的一种非常罕见","2","2"
"的一种非常罕见副","2","2"
"一种非常罕见副作","2","2"
"种非常罕见副作用","2","2"
"有政府背景的中国","2","2"
"斯利康新冠疫苗的","2","2"
"运河管理局主席表","2","2"
"河管理局主席表示","2","2"
"年里三星和台积电","2","2"
"里三星和台积电的","2","2"
"三星和台积电的垄","2","2"
"星和台积电的垄断","2","2"
"和台积电的垄断逐","2","2"
"台积电的垄断逐步","2","2"
"积电的垄断逐步加","2","2"
"电的垄断逐步加强","2","2"
"提供电力和保护的","2","2"
"供电力和保护的陶","2","2"
"电力和保护的陶瓷","2","2"
"力和保护的陶瓷封","2","2"
"和保护的陶瓷封装","2","2"
"种阿斯利康疫苗后","2","2"
"国家运输安全调查","2","2"
"家运输安全调查委","2","2"
"东京上野公园赏樱","2","2"
"京上野公园赏樱游","2","2"
"上野公园赏樱游人","2","2"
"野公园赏樱游人如","2","2"
"公园赏樱游人如织","2","2"
"在东京圈解除紧急","2","2"
"东京圈解除紧急宣","2","2"
"京圈解除紧急宣言","2","2"
"圈解除紧急宣言的","2","2"
"解除紧急宣言的首","2","2"
"除紧急宣言的首个","2","2"
"紧急宣言的首个周","2","2"
"急宣言的首个周末","2","2"
"正逢樱花的最佳观","2","2"
"逢樱花的最佳观赏","2","2"
"樱花的最佳观赏期","2","2"
"上野公园内出现了","2","2"
"野公园内出现了游","2","2"
"公园内出现了游客","2","2"
"园内出现了游客摩","2","2"
"内出现了游客摩肩","2","2"
"出现了游客摩肩接","2","2"
"现了游客摩肩接踵","2","2"
"了游客摩肩接踵的","2","2"
"做好了人多拥挤的","2","2"
"好了人多拥挤的心","2","2"
"了人多拥挤的心理","2","2"
"人多拥挤的心理准","2","2"
"多拥挤的心理准备","2","2"
"拥挤的心理准备而","2","2"
"挤的心理准备而来","2","2"
"斯利康新冠疫苗有","2","2"
"利康新冠疫苗有关","2","2"
"散户如何挑战华尔","2","2"
"户如何挑战华尔街","2","2"
"针对华尔街精英的","2","2"
"对华尔街精英的空","2","2"
"华尔街精英的空头","2","2"
"尔街精英的空头挤","2","2"
"街精英的空头挤压","2","2"
"精英的空头挤压是","2","2"
"英的空头挤压是如","2","2"
"的空头挤压是如何","2","2"
"空头挤压是如何展","2","2"
"头挤压是如何展开","2","2"
"挤压是如何展开的","2","2"
"以及这对对冲基金","2","2"
"及这对对冲基金和","2","2"
"这对对冲基金和做","2","2"
"对对冲基金和做空","2","2"
"对冲基金和做空意","2","2"
"冲基金和做空意味","2","2"
"基金和做空意味着","2","2"
"金和做空意味着什","2","2"
"和做空意味着什么","2","2"
"展开冠病疫苗接种","2","2"
"开冠病疫苗接种工","2","2"
"日美两国企业再次","2","2"
"美两国企业再次走","2","2"
"两国企业再次走近","2","2"
"年丰田和通用汽车","2","2"
"发那科和通用电气","2","2"
"那科和通用电气给","2","2"
"科和通用电气给历","2","2"
"和通用电气给历史","2","2"
"通用电气给历史性","2","2"
"用电气给历史性的","2","2"
"电气给历史性的合","2","2"
"气给历史性的合作","2","2"
"给历史性的合作关","2","2"
"历史性的合作关系","2","2"
"史性的合作关系画","2","2"
"性的合作关系画上","2","2"
"的合作关系画上终","2","2"
"合作关系画上终止","2","2"
"作关系画上终止符","2","2"
"三菱重工和卡特彼","2","2"
"菱重工和卡特彼勒","2","2"
"重工和卡特彼勒也","2","2"
"工和卡特彼勒也大","2","2"
"和卡特彼勒也大幅","2","2"
"卡特彼勒也大幅缩","2","2"
"特彼勒也大幅缩小","2","2"
"彼勒也大幅缩小合","2","2"
"勒也大幅缩小合作","2","2"
"当时在雷曼危机后","2","2"
"日美企业都转向中","2","2"
"美企业都转向中国","2","2"
"企业都转向中国寻","2","2"
"业都转向中国寻找","2","2"
"都转向中国寻找市","2","2"
"转向中国寻找市场","2","2"
"向中国寻找市场与","2","2"
"中国寻找市场与合","2","2"
"国寻找市场与合作","2","2"
"寻找市场与合作关","2","2"
"找市场与合作关系","2","2"
"但现在日美企业面","2","2"
"现在日美企业面临","2","2"
"在日美企业面临的","2","2"
"日美企业面临的环","2","2"
"美企业面临的环境","2","2"
"企业面临的环境有","2","2"
"业面临的环境有所","2","2"
"面临的环境有所改","2","2"
"临的环境有所改变","2","2"
"国监管部门的批准","2","2"
"台积电商讨再涨价","2","2"
"台积电等正在商讨","2","2"
"积电等正在商讨最","2","2"
"电等正在商讨最多","2","2"
"等正在商讨最多提","2","2"
"正在商讨最多提价","2","2"
"主要是车载半导体","2","2"
"年秋季起在局部实","2","2"
"秋季起在局部实施","2","2"
"季起在局部实施了","2","2"
"起在局部实施了涨","2","2"
"在局部实施了涨价","2","2"
"但将再次要求涨价","2","2"
"短期间内持续涨价","2","2"
"体现出定价权从汽","2","2"
"现出定价权从汽车","2","2"
"出定价权从汽车厂","2","2"
"定价权从汽车厂商","2","2"
"价权从汽车厂商到","2","2"
"权从汽车厂商到半","2","2"
"从汽车厂商到半导","2","2"
"汽车厂商到半导体","2","2"
"车厂商到半导体厂","2","2"
"厂商到半导体厂商","2","2"
"商到半导体厂商的","2","2"
"到半导体厂商的转","2","2"
"半导体厂商的转移","2","2"
"感染方面非常有效","2","2"
"美国亚特兰大按摩","2","2"
"国亚特兰大按摩店","2","2"
"亚特兰大按摩店枪","2","2"
"特兰大按摩店枪击","2","2"
"兰大按摩店枪击案","2","2"
"大按摩店枪击案将","2","2"
"按摩店枪击案将亚","2","2"
"摩店枪击案将亚裔","2","2"
"店枪击案将亚裔移","2","2"
"枪击案将亚裔移民","2","2"
"击案将亚裔移民按","2","2"
"案将亚裔移民按摩","2","2"
"将亚裔移民按摩师","2","2"
"亚裔移民按摩师推","2","2"
"裔移民按摩师推到","2","2"
"移民按摩师推到了","2","2"
"民按摩师推到了风","2","2"
"按摩师推到了风口","2","2"
"摩师推到了风口浪","2","2"
"师推到了风口浪尖","2","2"
"由于美国的按摩行","2","2"
"于美国的按摩行业","2","2"
"美国的按摩行业龙","2","2"
"国的按摩行业龙蛇","2","2"
"的按摩行业龙蛇混","2","2"
"按摩行业龙蛇混杂","2","2"
"正规的亚裔按摩店","2","2"
"规的亚裔按摩店长","2","2"
"的亚裔按摩店长久","2","2"
"亚裔按摩店长久以","2","2"
"裔按摩店长久以来","2","2"
"按摩店长久以来被","2","2"
"摩店长久以来被污","2","2"
"店长久以来被污名","2","2"
"长久以来被污名化","2","2"
"被视作性交易场所","2","2"
"两位华人女性按摩","2","2"
"位华人女性按摩师","2","2"
"华人女性按摩师向","2","2"
"诉说她们遭遇的污","2","2"
"说她们遭遇的污名","2","2"
"她们遭遇的污名与","2","2"
"们遭遇的污名与骚","2","2"
"遭遇的污名与骚扰","2","2"
"马来西亚首相慕尤","2","2"
"来西亚首相慕尤丁","2","2"
"和国家安全理事会","2","2"
"国家安全理事会讨","2","2"
"家安全理事会讨论","2","2"
"安全理事会讨论后","2","2"
"决定让已接种两剂","2","2"
"定让已接种两剂冠","2","2"
"让已接种两剂冠病","2","2"
"已接种两剂冠病疫","2","2"
"两剂冠病疫苗的民","2","2"
"剂冠病疫苗的民众","2","2"
"冠病疫苗的民众自","2","2"
"病疫苗的民众自由","2","2"
"疫苗的民众自由跨","2","2"
"苗的民众自由跨州","2","2"
"摩托厂商将统一电","2","2"
"托厂商将统一电池","2","2"
"厂商将统一电池规","2","2"
"商将统一电池规格","2","2"
"包括日本人和外国","2","2"
"括日本人和外国人","2","2"
"日本人和外国人在","2","2"
"本人和外国人在内","2","2"
"人和外国人在内的","2","2"
"和外国人在内的普","2","2"
"外国人在内的普通","2","2"
"国人在内的普通劳","2","2"
"人在内的普通劳动","2","2"
"在内的普通劳动者","2","2"
"内的普通劳动者的","2","2"
"的普通劳动者的工","2","2"
"普通劳动者的工资","2","2"
"跃居全球份额首位","2","2"
"鞋的中底内置了轻","2","2"
"的中底内置了轻量","2","2"
"中底内置了轻量碳","2","2"
"底内置了轻量碳板","2","2"
"日立制作所将收购","2","2"
"立制作所将收购美","2","2"
"制作所将收购美国","2","2"
"这是日本相关行业","2","2"
"是日本相关行业里","2","2"
"日本相关行业里过","2","2"
"本相关行业里过去","2","2"
"相关行业里过去最","2","2"
"关行业里过去最大","2","2"
"行业里过去最大级","2","2"
"业里过去最大级别","2","2"
"里过去最大级别的","2","2"
"过去最大级别的收","2","2"
"去最大级别的收购","2","2"
"比特币和加密货币","2","2"
"个月以内重启生产","2","2"
"苏伊士运河搁浅近","2","2"
"伊士运河搁浅近一","2","2"
"士运河搁浅近一周","2","2"
"人群接种阿斯利康","2","2"
"群接种阿斯利康的","2","2"
"苏伊士运河恢复通","2","2"
"伊士运河恢复通航","2","2"
"收购原日立旗下企","2","2"
"购原日立旗下企业","2","2"
"苏伊士运河搁浅的","2","2"
"在新冠疫苗供应持","2","2"
"新冠疫苗供应持续","2","2"
"冠疫苗供应持续紧","2","2"
"疫苗供应持续紧张","2","2"
"苗供应持续紧张的","2","2"
"供应持续紧张的背","2","2"
"应持续紧张的背景","2","2"
"持续紧张的背景下","2","2"
"法国指责英国在处","2","2"
"国指责英国在处理","2","2"
"指责英国在处理新","2","2"
"责英国在处理新冠","2","2"
"英国在处理新冠疫","2","2"
"国在处理新冠疫苗","2","2"
"在处理新冠疫苗出","2","2"
"处理新冠疫苗出口","2","2"
"理新冠疫苗出口问","2","2"
"新冠疫苗出口问题","2","2"
"冠疫苗出口问题上","2","2"
"疫苗出口问题上存","2","2"
"苗出口问题上存在","2","2"
"台湾行政院长苏贞","2","2"
"湾行政院长苏贞昌","2","2"
"毅力号火星探测车","2","2"
"力号火星探测车传","2","2"
"号火星探测车传回","2","2"
"火星探测车传回在","2","2"
"星探测车传回在火","2","2"
"探测车传回在火星","2","2"
"测车传回在火星表","2","2"
"车传回在火星表面","2","2"
"传回在火星表面录","2","2"
"回在火星表面录到","2","2"
"在火星表面录到的","2","2"
"火星表面录到的声","2","2"
"星表面录到的声音","2","2"
"听听有没有外星生","2","2"
"听有没有外星生命","2","2"
"拥有世界最大规模","2","2"
"有世界最大规模的","2","2"
"疫苗接种计划进展","2","2"
"苗接种计划进展顺","2","2"
"接种计划进展顺利","2","2"
"造成双向航道阻塞","2","2"
"周二在苏伊士运河","2","2"
"阿斯利康疫苗接种","2","2"
"个衡量标准看全球","2","2"
"衡量标准看全球竞","2","2"
"量标准看全球竞争","2","2"
"衡量半导体产业强","2","2"
"量半导体产业强弱","2","2"
"半导体产业强弱的","2","2"
"导体产业强弱的标","2","2"
"体产业强弱的标准","2","2"
"产业强弱的标准大","2","2"
"业强弱的标准大体","2","2"
"强弱的标准大体上","2","2"
"弱的标准大体上分","2","2"
"的标准大体上分为","2","2"
"日本在材料和制造","2","2"
"本在材料和制造设","2","2"
"材料和制造设备在","2","2"
"料和制造设备在世","2","2"
"和制造设备在世界","2","2"
"制造设备在世界上","2","2"
"造设备在世界上具","2","2"
"设备在世界上具有","2","2"
"备在世界上具有优","2","2"
"在世界上具有优势","2","2"
"中国大陆在设计上","2","2"
"国大陆在设计上显","2","2"
"大陆在设计上显示","2","2"
"陆在设计上显示出","2","2"
"在设计上显示出实","2","2"
"设计上显示出实力","2","2"
"日本产业技术综合","2","2"
"本产业技术综合研","2","2"
"产业技术综合研究","2","2"
"业技术综合研究所","2","2"
"与一家特殊目的收","2","2"
"一家特殊目的收购","2","2"
"家特殊目的收购公","2","2"
"施打阿斯利康的新","2","2"
"打阿斯利康的新冠","2","2"
"此举加强了其对国","2","2"
"举加强了其对国内","2","2"
"加强了其对国内公","2","2"
"强了其对国内公共","2","2"
"了其对国内公共和","2","2"
"其对国内公共和私","2","2"
"对国内公共和私人","2","2"
"国内公共和私人话","2","2"
"内公共和私人话语","2","2"
"公共和私人话语空","2","2"
"共和私人话语空间","2","2"
"和私人话语空间的","2","2"
"私人话语空间的控","2","2"
"人话语空间的控制","2","2"
"问题周日就出现了","2","2"
"包括注册遇阻和网","2","2"
"括注册遇阻和网络","2","2"
"注册遇阻和网络屏","2","2"
"册遇阻和网络屏蔽","2","2"
"针对有关这款应用","2","2"
"对有关这款应用被","2","2"
"有关这款应用被禁","2","2"
"关这款应用被禁用","2","2"
"这款应用被禁用的","2","2"
"款应用被禁用的记","2","2"
"应用被禁用的记者","2","2"
"用被禁用的记者提","2","2"
"被禁用的记者提问","2","2"
"中国外交部周二建","2","2"
"国外交部周二建议","2","2"
"外交部周二建议向","2","2"
"交部周二建议向主","2","2"
"部周二建议向主管","2","2"
"周二建议向主管部","2","2"
"二建议向主管部门","2","2"
"建议向主管部门了","2","2"
"议向主管部门了解","2","2"
"但称中国互联网是","2","2"
"称中国互联网是开","2","2"
"将漫天黑压压的蝗","2","2"
"漫天黑压压的蝗虫","2","2"
"天黑压压的蝗虫变","2","2"
"黑压压的蝗虫变成","2","2"
"压压的蝗虫变成实","2","2"
"压的蝗虫变成实实","2","2"
