"8gram","Frequency","Total Tweets"
"华特迪士尼公司的","2","2"
"新冠肺炎病例激增","2","2"
"日本药企第一三共","2","2"
"一种快速传播的新","2","2"
"种快速传播的新冠","2","2"
"传出蔬菜价格暴涨","2","2"
"国内贸易与消费事","2","2"
"内贸易与消费事务","2","2"
"贸易与消费事务部","2","2"
"染病研究所所长福","2","2"
"病研究所所长福奇","2","2"
"冠病新变种病毒株","2","2"
"你心目中的年度汉","2","2"
"心目中的年度汉字","2","2"
"物理学家爱因斯坦","2","2"
"美国制药公司诺瓦","2","2"
"国制药公司诺瓦瓦","2","2"
"制药公司诺瓦瓦克","2","2"
"药公司诺瓦瓦克斯","2","2"
"世界卫生组织星期","2","2"
"界卫生组织星期五","2","2"
"阿里巴巴首席执行","2","2"
"里巴巴首席执行官","2","2"
"巴巴首席执行官张","2","2"
"巴首席执行官张勇","2","2"
"泰国冠病疫情管理","2","2"
"国冠病疫情管理中","2","2"
"冠病疫情管理中心","2","2"
"低风险国家和地区","2","2"
"风险国家和地区的","2","2"
"太平洋岛国所罗门","2","2"
"平洋岛国所罗门群","2","2"
"洋岛国所罗门群岛","2","2"
"彭博援引匿名消息","2","2"
"中国监管机构要求","2","2"
"东京奥运会乒乓球","2","2"
"乒乓球混双决赛中","2","2"
"中央银行数字货币","2","2"
"患者的住院和死亡","2","2"
"接种疫苗有哪些副","2","2"
"种疫苗有哪些副作","2","2"
"疫苗有哪些副作用","2","2"
"不同疫苗混合接种","2","2"
"同疫苗混合接种是","2","2"
"疫苗混合接种是否","2","2"
"苗混合接种是否可","2","2"
"混合接种是否可行","2","2"
"免疫效力可持续多","2","2"
"疫效力可持续多久","2","2"
"韩国中央防疫对策","2","2"
"国中央防疫对策本","2","2"
"中央防疫对策本部","2","2"
"英国政府委托进行","2","2"
"国政府委托进行的","2","2"
"美联储理事布雷纳","2","2"
"联储理事布雷纳德","2","2"
"中国领导人习近平","2","2"
"日元兑美元汇率一","2","2"
"元兑美元汇率一度","2","2"
"兑美元汇率一度跌","2","2"
"美元汇率一度跌至","2","2"
"提名美联储主席鲍","2","2"
"名美联储主席鲍威","2","2"
"联储主席鲍威尔连","2","2"
"储主席鲍威尔连任","2","2"
"泰国国家经济和社","2","2"
"国国家经济和社会","2","2"
"国家经济和社会发","2","2"
"家经济和社会发展","2","2"
"经济和社会发展委","2","2"
"济和社会发展委员","2","2"
"和社会发展委员会","2","2"
"大联盟最有价值球","2","2"
"联盟最有价值球员","2","2"
"从新冠疫情中复苏","2","2"
"年的十个候选汉字","2","2"
"的十个候选汉字之","2","2"
"十个候选汉字之前","2","2"
"我们一起用幽默的","2","2"
"们一起用幽默的方","2","2"
"一起用幽默的方式","2","2"
"回顾新加坡过去十","2","2"
"顾新加坡过去十年","2","2"
"新加坡过去十年的","2","2"
"加坡过去十年的获","2","2"
"坡过去十年的获选","2","2"
"过去十年的获选汉","2","2"
"去十年的获选汉字","2","2"
"跨部门工作小组记","2","2"
"部门工作小组记者","2","2"
"门工作小组记者会","2","2"
"工作小组记者会上","2","2"
"完成疫苗接种程序","2","2"
"完成疫苗全程接种","2","2"
"易和发展会议的数","2","2"
"和发展会议的数据","2","2"
"柔佛州务大臣哈斯","2","2"
"佛州务大臣哈斯尼","2","2"
"美国卫生监管机构","2","2"
"首款量产纯电动汽","2","2"
"款量产纯电动汽车","2","2"
"美国西海岸的运输","2","2"
"与中国养猪业有关","2","2"
"澳大利亚昆士兰州","2","2"
"步放宽边境管制措","2","2"
"放宽边境管制措施","2","2"
"美国公司及其在华","2","2"
"国公司及其在华分","2","2"
"公司及其在华分支","2","2"
"司及其在华分支机","2","2"
"及其在华分支机构","2","2"
"其在华分支机构正","2","2"
"在华分支机构正在","2","2"
"华分支机构正在加","2","2"
"分支机构正在加大","2","2"
"支机构正在加大对","2","2"
"机构正在加大对中","2","2"
"构正在加大对中国","2","2"
"正在加大对中国半","2","2"
"在加大对中国半导","2","2"
"加大对中国半导体","2","2"
"大对中国半导体公","2","2"
"对中国半导体公司","2","2"
"中国半导体公司的","2","2"
"国半导体公司的投","2","2"
"半导体公司的投资","2","2"
"导体公司的投资力","2","2"
"体公司的投资力度","2","2"
"芯片行业的主导地","2","2"
"片行业的主导地位","2","2"
"了人们的日常生活","2","2"
"第三季度经济同比","2","2"
"新冠疫情防控措施","2","2"
"于新冠疫情带来的","2","2"
"的冠病疫苗接种率","2","2"
"美国制药巨头辉瑞","2","2"
"无论他们是否接种","2","2"
"前的冠病疫苗接种","2","2"
"年开始调查以来的","2","2"
"开始调查以来的最","2","2"
"始调查以来的最低","2","2"
"调查以来的最低水","2","2"
"查以来的最低水平","2","2"
"英国药品与保健品","2","2"
"国药品与保健品管","2","2"
"药品与保健品管理","2","2"
"品与保健品管理局","2","2"
"总统杜特尔特警告","2","2"
"马来西亚冠病确诊","2","2"
"来西亚冠病确诊病","2","2"
"西亚冠病确诊病例","2","2"
"或阻碍电动车普及","2","2"
"用于纯电动汽车电","2","2"
"于纯电动汽车电池","2","2"
"电动汽车电池的代","2","2"
"动汽车电池的代表","2","2"
"汽车电池的代表性","2","2"
"车电池的代表性金","2","2"
"电池的代表性金属","2","2"
"池的代表性金属锂","2","2"
"的代表性金属锂的","2","2"
"代表性金属锂的价","2","2"
"表性金属锂的价格","2","2"
"性金属锂的价格已","2","2"
"金属锂的价格已涨","2","2"
"属锂的价格已涨至","2","2"
"根本原因是伴随脱","2","2"
"本原因是伴随脱碳","2","2"
"原因是伴随脱碳趋","2","2"
"因是伴随脱碳趋势","2","2"
"是伴随脱碳趋势的","2","2"
"伴随脱碳趋势的纯","2","2"
"随脱碳趋势的纯电","2","2"
"脱碳趋势的纯电动","2","2"
"碳趋势的纯电动汽","2","2"
"趋势的纯电动汽车","2","2"
"势的纯电动汽车需","2","2"
"的纯电动汽车需求","2","2"
"纯电动汽车需求的","2","2"
"电动汽车需求的增","2","2"
"动汽车需求的增加","2","2"
"供应的不足和成本","2","2"
"应的不足和成本上","2","2"
"的不足和成本上升","2","2"
"不足和成本上升也","2","2"
"具有里程碑意义的","2","2"
"冠病疫苗接种的民","2","2"
"病疫苗接种的民众","2","2"
"霍普金斯大学汇编","2","2"
"普金斯大学汇编的","2","2"
"金斯大学汇编的数","2","2"
"斯大学汇编的数据","2","2"
"智能手机市场的份","2","2"
"能手机市场的份额","2","2"
"实现全球温室气体","2","2"
"现全球温室气体净","2","2"
"全球温室气体净零","2","2"
"球温室气体净零排","2","2"
"气体净零排放的目","2","2"
"体净零排放的目标","2","2"
"冠病疫苗的外国人","2","2"
"成为全球市值最高","2","2"
"为全球市值最高的","2","2"
"英国一项研究发现","2","2"
"体育赛事和音乐会","2","2"
"世界上最有价值的","2","2"
"界上最有价值的公","2","2"
"上最有价值的公司","2","2"
"在吉隆坡国际机场","2","2"
"的液化天然气进口","2","2"
"液化天然气进口量","2","2"
"受访房地产分析师","2","2"
"一项最新调查显示","2","2"
"食品药品管理局的","2","2"
"达到历史最高水平","2","2"
"冠病疫苗追加剂的","2","2"
"完成接种两剂冠病","2","2"
"成接种两剂冠病疫","2","2"
"不使用稀有金属的","2","2"
"能源及天然资源部","2","2"
"源及天然资源部宣","2","2"
"及天然资源部宣布","2","2"
"基进党立委陈柏惟","2","2"
"进党立委陈柏惟罢","2","2"
"党立委陈柏惟罢免","2","2"
"国债和抵押贷款支","2","2"
"债和抵押贷款支持","2","2"
"接种莫德纳冠病疫","2","2"
"种莫德纳冠病疫苗","2","2"
"失业救济金人数从","2","2"
"业救济金人数从之","2","2"
"救济金人数从之前","2","2"
"济金人数从之前一","2","2"
"金人数从之前一周","2","2"
"万日元约合人民币","2","2"
"冠病确诊病例不断","2","2"
"和强生公司的加强","2","2"
"项研究的初步结果","2","2"
"允许完成冠病疫苗","2","2"
"许完成冠病疫苗接","2","2"
"新加坡非石油国内","2","2"
"加坡非石油国内出","2","2"
"坡非石油国内出口","2","2"
"许多大宗商品价格","2","2"
"种冠病疫苗加强剂","2","2"
"拒绝接种冠病疫苗","2","2"
"绝接种冠病疫苗的","2","2"
"财年创出利润新高","2","2"
"优衣库在中国大陆","2","2"
"日本制铁起诉丰田","2","2"
"本制铁起诉丰田和","2","2"
"美国首次申请失业","2","2"
"国首次申请失业救","2","2"
"美国汽车安全监管","2","2"
"国汽车安全监管机","2","2"
"车安全监管机构正","2","2"
"安全监管机构正在","2","2"
"监管机构正在加强","2","2"
"管机构正在加强对","2","2"
"的售价约合人民币","2","2"
"未接种疫苗的公众","2","2"
"接种疫苗的公众不","2","2"
"恒大问题是日本型","2","2"
"泡沫在全球转来转","2","2"
"沫在全球转来转去","2","2"
"日本泡沫破裂的影","2","2"
"本泡沫破裂的影响","2","2"
"泡沫破裂的影响局","2","2"
"沫破裂的影响局限","2","2"
"破裂的影响局限于","2","2"
"裂的影响局限于日","2","2"
"的影响局限于日本","2","2"
"影响局限于日本国","2","2"
"响局限于日本国内","2","2"
"但美国的金融危机","2","2"
"美国的金融危机在","2","2"
"国的金融危机在全","2","2"
"的金融危机在全球","2","2"
"金融危机在全球范","2","2"
"融危机在全球范围","2","2"
"危机在全球范围留","2","2"
"机在全球范围留下","2","2"
"在全球范围留下了","2","2"
"全球范围留下了伤","2","2"
"球范围留下了伤痕","2","2"
"中国需要吸取危机","2","2"
"国需要吸取危机的","2","2"
"需要吸取危机的教","2","2"
"要吸取危机的教训","2","2"
"韩国单日新增冠病","2","2"
"德尔塔变种病毒的","2","2"
"历史上规模最大的","2","2"
"较历史高点下跌了","2","2"
"澳大利亚总理莫里","2","2"
"大利亚总理莫里森","2","2"
"利亚总理莫里森周","2","2"
"第一阶段贸易协议","2","2"
"架军机进入台湾西","2","2"
"入台湾西南防空识","2","2"
"台湾西南防空识别","2","2"
"湾西南防空识别区","2","2"
"新西兰总理阿德恩","2","2"
"日本拉面被认为来","2","2"
"本拉面被认为来自","2","2"
"拉面被认为来自中","2","2"
"面被认为来自中国","2","2"
"但又发展出独自的","2","2"
"又发展出独自的特","2","2"
"发展出独自的特色","2","2"
"日本汽车工业会会","2","2"
"本汽车工业会会长","2","2"
"台湾冠病疫情趋缓","2","2"
"在香港上市的计划","2","2"
"宾总统杜特尔特表","2","2"
"总统杜特尔特表示","2","2"
"首相拿督斯里依斯","2","2"
"相拿督斯里依斯迈","2","2"
"拿督斯里依斯迈沙","2","2"
"督斯里依斯迈沙比","2","2"
"斯里依斯迈沙比里","2","2"
"自新冠疫情暴发以","2","2"
"国前总统特朗普的","2","2"
"布的官方数据显示","2","2"
"行政改革部长河野","2","2"
"政改革部长河野太","2","2"
"改革部长河野太郎","2","2"
"防止蔓延等重点措","2","2"
"止蔓延等重点措施","2","2"
"年实现净零排放的","2","2"
"剂冠病疫苗接种的","2","2"
"新加坡前资深外交","2","2"
"加坡前资深外交官","2","2"
"苹果公司新发布的","2","2"
"在日本市场售价比","2","2"
"日本市场售价比之","2","2"
"本市场售价比之前","2","2"
"市场售价比之前的","2","2"
"系列最贵的机型高","2","2"
"列最贵的机型高出","2","2"
"最贵的机型高出约","2","2"
"顶配机型价格在最","2","2"
"配机型价格在最近","2","2"
"的花销在日本人月","2","2"
"将对之后的新增加","2","2"
"对之后的新增加入","2","2"
"之后的新增加入者","2","2"
"后的新增加入者具","2","2"
"的新增加入者具有","2","2"
"新增加入者具有否","2","2"
"增加入者具有否决","2","2"
"加入者具有否决权","2","2"
"因此日本等成员国","2","2"
"此日本等成员国似","2","2"
"日本等成员国似乎","2","2"
"本等成员国似乎不","2","2"
"等成员国似乎不得","2","2"
"成员国似乎不得不","2","2"
"员国似乎不得不在","2","2"
"国似乎不得不在事","2","2"
"似乎不得不在事实","2","2"
"乎不得不在事实上","2","2"
"不得不在事实上在","2","2"
"得不在事实上在大","2","2"
"不在事实上在大陆","2","2"
"在事实上在大陆和","2","2"
"事实上在大陆和台","2","2"
"实上在大陆和台湾","2","2"
"上在大陆和台湾之","2","2"
"在大陆和台湾之间","2","2"
"大陆和台湾之间选","2","2"
"陆和台湾之间选择","2","2"
"成员国之间已出现","2","2"
"员国之间已出现温","2","2"
"国之间已出现温度","2","2"
"之间已出现温度差","2","2"
"新冠疫情开始以来","2","2"
"对全球经济增长的","2","2"
"总编辑胡锡进昨天","2","2"
"就北京环球影城正","2","2"
"北京环球影城正式","2","2"
"京环球影城正式开","2","2"
"环球影城正式开园","2","2"
"球影城正式开园发","2","2"
"影城正式开园发文","2","2"
"城正式开园发文评","2","2"
"正式开园发文评论","2","2"
"式开园发文评论说","2","2"
"北京环球影城开业","2","2"
"京环球影城开业时","2","2"
"环球影城开业时机","2","2"
"球影城开业时机较","2","2"
"影城开业时机较特","2","2"
"城开业时机较特别","2","2"
"开幕的盛况呈现了","2","2"
"幕的盛况呈现了中","2","2"
"的盛况呈现了中美","2","2"
"盛况呈现了中美民","2","2"
"况呈现了中美民间","2","2"
"呈现了中美民间交","2","2"
"现了中美民间交往","2","2"
"了中美民间交往的","2","2"
"中美民间交往的热","2","2"
"美民间交往的热情","2","2"
"民间交往的热情和","2","2"
"间交往的热情和仍","2","2"
"交往的热情和仍在","2","2"
"往的热情和仍在扩","2","2"
"的热情和仍在扩大","2","2"
"热情和仍在扩大的","2","2"
"情和仍在扩大的交","2","2"
"和仍在扩大的交往","2","2"
"仍在扩大的交往能","2","2"
"在扩大的交往能量","2","2"
"传递出的信号胜于","2","2"
"递出的信号胜于千","2","2"
"出的信号胜于千言","2","2"
"的信号胜于千言万","2","2"
"信号胜于千言万语","2","2"
"卫生总监丹斯里诺","2","2"
"生总监丹斯里诺希","2","2"
"总监丹斯里诺希山","2","2"
"日本自民党总裁选","2","2"
"上海恩捷新材料科","2","2"
"海恩捷新材料科技","2","2"
"提高了摄像头和电","2","2"
"高了摄像头和电池","2","2"
"了摄像头和电池性","2","2"
"摄像头和电池性能","2","2"
"像头和电池性能等","2","2"
"目前手机市场已经","2","2"
"前手机市场已经成","2","2"
"手机市场已经成熟","2","2"
"放弃其他厂商产品","2","2"
"弃其他厂商产品改","2","2"
"其他厂商产品改用","2","2"
"销售增加的最大因","2","2"
"售增加的最大因素","2","2"
"增加的最大因素其","2","2"
"加的最大因素其实","2","2"
"的最大因素其实是","2","2"
"随着时间推移而减","2","2"
"与美国国务卿布林","2","2"
"国反垄断监管机构","2","2"
"新冠疫情前的水平","2","2"
"日本信息通信研究","2","2"
"本信息通信研究机","2","2"
"信息通信研究机构","2","2"
"日本新冠疫苗接种","2","2"
"完成两剂新冠疫苗","2","2"
"成两剂新冠疫苗接","2","2"
"两剂新冠疫苗接种","2","2"
"中国大陆社交媒体","2","2"
"柔佛国际会展中心","2","2"
"美国存托股票进行","2","2"
"国存托股票进行首","2","2"
"存托股票进行首次","2","2"
"托股票进行首次公","2","2"
"股票进行首次公开","2","2"
"票进行首次公开募","2","2"
"进行首次公开募股","2","2"
"新冠德尔塔毒株疫","2","2"
"冠德尔塔毒株疫情","2","2"
"国家过敏和传染病","2","2"
"家过敏和传染病研","2","2"
"过敏和传染病研究","2","2"
"敏和传染病研究所","2","2"
"半导体新材料主导","2","2"
"导体新材料主导权","2","2"
"体新材料主导权争","2","2"
"新材料主导权争夺","2","2"
"材料主导权争夺拉","2","2"
"料主导权争夺拉开","2","2"
"主导权争夺拉开序","2","2"
"导权争夺拉开序幕","2","2"
"半导体的基板材料","2","2"
"导体的基板材料长","2","2"
"体的基板材料长期","2","2"
"的基板材料长期使","2","2"
"基板材料长期使用","2","2"
"板材料长期使用硅","2","2"
"但细微化面临极限","2","2"
"虽然芯片的堆叠等","2","2"
"然芯片的堆叠等各","2","2"
"芯片的堆叠等各种","2","2"
"片的堆叠等各种方","2","2"
"的堆叠等各种方式","2","2"
"堆叠等各种方式正","2","2"
"叠等各种方式正在","2","2"
"等各种方式正在被","2","2"
"各种方式正在被尝","2","2"
"种方式正在被尝试","2","2"
"取代硅的新材料也","2","2"
"代硅的新材料也备","2","2"
"硅的新材料也备受","2","2"
"的新材料也备受期","2","2"
"新材料也备受期待","2","2"
"省电化也在推进新","2","2"
"电化也在推进新材","2","2"
"化也在推进新材料","2","2"
"也在推进新材料的","2","2"
"在推进新材料的开","2","2"
"推进新材料的开发","2","2"
"进新材料的开发和","2","2"
"新材料的开发和使","2","2"
"材料的开发和使用","2","2"
"料的开发和使用取","2","2"
"的开发和使用取得","2","2"
"开发和使用取得进","2","2"
"发和使用取得进展","2","2"
"导体设备销售额增","2","2"
"体设备销售额增长","2","2"
"纯电动汽车零部件","2","2"
"对最大出口目的地","2","2"
"如果你的舌头是蓝","2","2"
"果你的舌头是蓝色","2","2"
"可以站着睡觉并长","2","2"
"以站着睡觉并长出","2","2"
"站着睡觉并长出四","2","2"
"着睡觉并长出四肢","2","2"
"然后用鹅卵石向爱","2","2"
"后用鹅卵石向爱人","2","2"
"用鹅卵石向爱人求","2","2"
"鹅卵石向爱人求婚","2","2"
"日本企业助力残奥","2","2"
"本企业助力残奥运","2","2"
"企业助力残奥运动","2","2"
"业助力残奥运动员","2","2"
"奥运会与残奥会男","2","2"
"运会与残奥会男子","2","2"
"米比赛获胜者的时","2","2"
"比赛获胜者的时间","2","2"
"赛获胜者的时间差","2","2"
"获胜者的时间差缩","2","2"
"胜者的时间差缩小","2","2"
"者的时间差缩小到","2","2"
"的时间差缩小到了","2","2"
"德国奥托博克等两","2","2"
"国奥托博克等两家","2","2"
"奥托博克等两家欧","2","2"
"托博克等两家欧洲","2","2"
"博克等两家欧洲企","2","2"
"克等两家欧洲企业","2","2"
"等两家欧洲企业是","2","2"
"两家欧洲企业是该","2","2"
"家欧洲企业是该领","2","2"
"欧洲企业是该领域","2","2"
"洲企业是该领域的","2","2"
"企业是该领域的龙","2","2"
"业是该领域的龙头","2","2"
"是该领域的龙头企","2","2"
"该领域的龙头企业","2","2"
"日本企业将投入通","2","2"
"本企业将投入通过","2","2"
"企业将投入通过产","2","2"
"业将投入通过产品","2","2"
"将投入通过产品制","2","2"
"投入通过产品制造","2","2"
"入通过产品制造积","2","2"
"通过产品制造积累","2","2"
"过产品制造积累的","2","2"
"产品制造积累的开","2","2"
"品制造积累的开发","2","2"
"制造积累的开发技","2","2"
"造积累的开发技术","2","2"
"基金资产管理规模","2","2"
"者的病床使用率已","2","2"
"的病床使用率已达","2","2"
"在一份报告中表示","2","2"
"智能手机和数据中","2","2"
"能手机和数据中心","2","2"
"日本信越化学工业","2","2"
"本信越化学工业和","2","2"
"持续的供应链挑战","2","2"
"部长拿督斯里阿汉","2","2"
"长拿督斯里阿汉峇","2","2"
"拿督斯里阿汉峇峇","2","2"
"进口方面不断缩短","2","2"
"口方面不断缩短合","2","2"
"方面不断缩短合同","2","2"
"面不断缩短合同期","2","2"
"不断缩短合同期限","2","2"
"而经济持续扩大的","2","2"
"经济持续扩大的中","2","2"
"济持续扩大的中国","2","2"
"持续扩大的中国陆","2","2"
"续扩大的中国陆续","2","2"
"扩大的中国陆续签","2","2"
"大的中国陆续签订","2","2"
"的中国陆续签订了","2","2"
"年以上的大单合同","2","2"
"一般认为资源进口","2","2"
"般认为资源进口量","2","2"
"认为资源进口量越","2","2"
"为资源进口量越少","2","2"
"资源进口量越少越","2","2"
"源进口量越少越好","2","2"
"但有时也不能单纯","2","2"
"有时也不能单纯这","2","2"
"时也不能单纯这么","2","2"
"也不能单纯这么说","2","2"
"芯片短缺问题可能","2","2"
"片短缺问题可能会","2","2"
"律宾总统杜特蒂的","2","2"
"华尔街分析师的预","2","2"
"尔街分析师的预期","2","2"
"人沉迷网络游戏的","2","2"
"和法定节假日的每","2","2"
"向未成年人提供网","2","2"
"未成年人提供网络","2","2"
"成年人提供网络游","2","2"
"年人提供网络游戏","2","2"
"人提供网络游戏服","2","2"
"提供网络游戏服务","2","2"
"发现了一种新的变","2","2"
"现了一种新的变种","2","2"
"了一种新的变种冠","2","2"
"一种新的变种冠病","2","2"
"月全球销量创新高","2","2"
"首相巴育抗疫不力","2","2"
"英语已经取代华语","2","2"
"已完成两剂冠病疫","2","2"
"成两剂冠病疫苗接","2","2"
"两剂冠病疫苗接种","2","2"
"们比以往任何时候","2","2"
"婴儿爽身粉导致了","2","2"
"是一个不错的选择","2","2"
"中国驻加拿大大使","2","2"
"国驻加拿大大使丛","2","2"
"驻加拿大大使丛培","2","2"
"加拿大大使丛培武","2","2"
"月预期利润的市盈","2","2"
"预期利润的市盈率","2","2"
"受半导体短缺影响","2","2"
"过去五个交易日累","2","2"
"去五个交易日累计","2","2"
"加拿大多伦多大学","2","2"
"年下半年世界经济","2","2"
"下半年世界经济的","2","2"
"年以来的全球信用","2","2"
"以来的全球信用扩","2","2"
"来的全球信用扩张","2","2"
"的全球信用扩张迎","2","2"
"全球信用扩张迎来","2","2"
"球信用扩张迎来转","2","2"
"信用扩张迎来转折","2","2"
"用扩张迎来转折点","2","2"
"中美两个大国的资","2","2"
"美两个大国的资金","2","2"
"两个大国的资金增","2","2"
"个大国的资金增长","2","2"
"大国的资金增长踩","2","2"
"国的资金增长踩下","2","2"
"的资金增长踩下急","2","2"
"资金增长踩下急刹","2","2"
"金增长踩下急刹车","2","2"
"轴心货币美元也在","2","2"
"心货币美元也在恢","2","2"
"货币美元也在恢复","2","2"
"币美元也在恢复强","2","2"
"美元也在恢复强势","2","2"
"这对世界经济的稳","2","2"
"对世界经济的稳定","2","2"
"世界经济的稳定是","2","2"
"界经济的稳定是好","2","2"
"经济的稳定是好消","2","2"
"济的稳定是好消息","2","2"
"但也有可能付出代","2","2"
"也有可能付出代价","2","2"
"传染性的德尔塔变","2","2"
"染性的德尔塔变异","2","2"
"性的德尔塔变异毒","2","2"
"哈萨克斯坦南部的","2","2"
"萨克斯坦南部的曼","2","2"
"克斯坦南部的曼格","2","2"
"斯坦南部的曼格斯","2","2"
"坦南部的曼格斯套","2","2"
"南部的曼格斯套州","2","2"
"部的曼格斯套州出","2","2"
"的曼格斯套州出现","2","2"
"曼格斯套州出现了","2","2"
"格斯套州出现了异","2","2"
"斯套州出现了异常","2","2"
"套州出现了异常的","2","2"
"州出现了异常的高","2","2"
"出现了异常的高温","2","2"
"干旱的草原上四处","2","2"
"旱的草原上四处可","2","2"
"的草原上四处可见","2","2"
"草原上四处可见马","2","2"
"原上四处可见马的","2","2"
"上四处可见马的尸","2","2"
"四处可见马的尸体","2","2"
"严重的干旱不仅导","2","2"
"重的干旱不仅导致","2","2"
"的干旱不仅导致这","2","2"
"干旱不仅导致这些","2","2"
"旱不仅导致这些动","2","2"
"不仅导致这些动物","2","2"
"仅导致这些动物没","2","2"
"导致这些动物没有","2","2"
"致这些动物没有食","2","2"
"这些动物没有食物","2","2"
"些动物没有食物和","2","2"
"动物没有食物和水","2","2"
"也威胁到成百上千","2","2"
"威胁到成百上千牧","2","2"
"胁到成百上千牧民","2","2"
"到成百上千牧民的","2","2"
"成百上千牧民的生","2","2"
"百上千牧民的生计","2","2"
"中国广西汽车集团","2","2"
"国广西汽车集团的","2","2"
"引发洪水和山体滑","2","2"
"发洪水和山体滑坡","2","2"
"法国总统马克龙表","2","2"
"国总统马克龙表示","2","2"
"东京目前的冠病疫","2","2"
"京目前的冠病疫情","2","2"
"冠病疫情爆发以来","2","2"
"月营业收入的合计","2","2"
"营业收入的合计额","2","2"
